date_scraped,headline,source,TextBlob_sentiment,VADER_sentiment,FinBERT_sentiment,clean_headline
2024-05-09 12:00:50,"ChainGPT Pad Launches Engines of Fury, Bringing Enhanced Web3 Gaming Experiences to Mainstream Players",https://u.today/,0.0,-0.5719,Positive,"chaingpt pad launches engines of fury, bringing enhanced web3 gaming experiences to mainstream players"
2024-05-09 12:00:50,Leading Asian Crypto Info Provider CoinNess Launches English Live Feed with Free API Offer,https://u.today/,0.1340909090909091,0.5106,Positive,leading asian crypto info provider coinness launches english live feed with free api offer
2024-05-09 12:00:50,Bitfinex Pay and Awepay for Enterprise Payments Collaboration,https://u.today/,0.0,-0.1027,Neutral,bitfinex pay and awepay for enterprise payments collaboration
2024-05-09 12:00:50,Sealana: Can the Chubby Seal Move From Mom’s Basement to Top Meme Coin Rankings?,https://u.today/,0.5,0.2023,Neutral,sealana: can the chubby seal move from mom’s basement to top meme coin rankings?
2024-05-09 12:00:50,Viral Dogeverse Presale Nears $13M – Chain-Hopping Cosmo Brings Multibridge Utilities,https://u.today/,0.0,0.0,Neutral,viral dogeverse presale nears $13m – chain-hopping cosmo brings multibridge utilities
2024-05-09 12:00:50,WienerAI: The Viral New Meme Coin Reignites AI Crypto Frenzy With Sausage Army,https://u.today/,0.13636363636363635,-0.3182,Neutral,wienerai: the viral new meme coin reignites ai crypto frenzy with sausage army
2024-05-09 12:00:50,Multichain Meme Coin Dogeverse Hits $10M in Presale – Is it Too Late to Buy?,https://u.today/,-0.3,0.0,Neutral,multichain meme coin dogeverse hits $10m in presale – is it too late to buy?
2024-05-09 12:00:50,Traders Remain Bullish on Bitcoin Despite BTC Breaking Triangle Pattern; Are These Meme Coins a Good Buy On the Pullback?,https://u.today/,0.7,0.4404,Positive,traders remain bullish on bitcoin despite btc breaking triangle pattern; are these meme coins a good buy on the pullback?
2024-05-09 12:00:50,"New Memecoin GODLEN Emerges, As BOME & DogWifHat Are Chasing New Gains",https://u.today/,0.13636363636363635,0.34,Negative,"new memecoin godlen emerges, as bome & dogwifhat are chasing new gains"
2024-05-09 12:00:50,Stakingfarm Introduces New Passive Income Tools,https://u.today/,0.13636363636363635,0.2023,Neutral,stakingfarm introduces new passive income tools
2024-05-09 12:00:50,"99Bitcoins Launches Presale – Learn-to-Earn Platform Raises $100,000 in a Flash",https://u.today/,0.0,0.0,Neutral,"99bitcoins launches presale – learn-to-earn platform raises $100,000 in a flash"
2024-05-09 12:00:50,Phoenix Introduces Yield Platform with USDC Payouts: Review,https://u.today/,0.0,0.0,Neutral,phoenix introduces yield platform with usdc payouts: review
2024-05-09 12:00:50,Yield App Offers Easy-to-Use Crypto Wealth Platform: Review,https://u.today/,0.1,0.4939,Positive,yield app offers easy-to-use crypto wealth platform: review
2024-05-09 12:00:50,New-Gen Crypto Mining Ecosystem in 2024: Case of ViaBTC,https://u.today/,0.0,0.0,Neutral,new-gen crypto mining ecosystem in 2024: case of viabtc
2024-05-09 12:00:50,Lisk L2 Solution Onboards Obligate to Accelerate Crypto Adoption: Details,https://u.today/,0.0,0.3182,Positive,lisk l2 solution onboards obligate to accelerate crypto adoption: details
2024-05-09 12:00:50,Blocksquare's BST Token Now Integrated by Banxa Platform,https://u.today/,0.0,0.0,Neutral,blocksquare's bst token now integrated by banxa platform
2024-05-09 12:00:50,Salvor NFT Lending Protocol Secures $1 Million Incentive Grant From Avalanche,https://u.today/,0.0,0.743,Neutral,salvor nft lending protocol secures $1 million incentive grant from avalanche
2024-05-09 12:00:50,"Ethereum (ETH) on Verge of Fall, XRP Death Cross Solidifies, Solana (SOL) Breakout Could Be Fake",https://u.today/,-0.25,-0.7906,Positive,"ethereum (eth) on verge of fall, xrp death cross solidifies, solana (sol) breakout could be fake"
2024-05-09 12:00:50,"This Shiba Inu (SHIB) Pattern Changes Everything, Bitcoin (BTC) Might Come Back at $58,000, Cardano (ADA) Trend Flattens Out",https://u.today/,0.0,0.0,Neutral,"this shiba inu (shib) pattern changes everything, bitcoin (btc) might come back at $58,000, cardano (ada) trend flattens out"
2024-05-09 12:00:50,1.4 Billion Dogecoin (DOGE) in 24 Hours: Whales Are Waking Up,https://u.today/,0.0,0.0,Neutral,1.4 billion dogecoin (doge) in 24 hours: whales are waking up
2024-05-09 12:00:50,"Ethereum (ETH) on Verge of Fall, XRP Death Cross Solidifies, Solana (SOL) Breakout Could Be Fake",https://u.today/,-0.25,-0.7906,Positive,"ethereum (eth) on verge of fall, xrp death cross solidifies, solana (sol) breakout could be fake"
2024-05-09 12:00:50,"This Shiba Inu (SHIB) Pattern Changes Everything, Bitcoin (BTC) Might Come Back at $58,000, Cardano (ADA) Trend Flattens Out",https://u.today/,0.0,0.0,Neutral,"this shiba inu (shib) pattern changes everything, bitcoin (btc) might come back at $58,000, cardano (ada) trend flattens out"
2024-05-09 12:00:50,1.4 Billion Dogecoin (DOGE) in 24 Hours: Whales Are Waking Up,https://u.today/,0.0,0.0,Neutral,1.4 billion dogecoin (doge) in 24 hours: whales are waking up
2024-05-09 12:00:50,DOGE Price Prediction for May 9,https://u.today/,0.0,0.0,Neutral,doge price prediction for may 9
2024-05-09 12:00:50,Bitcoin (BTC) Price Prediction for May 8,https://u.today/,0.0,0.0,Neutral,bitcoin (btc) price prediction for may 8
2024-05-09 12:00:50,XRP Price Prediction for May 8,https://u.today/,0.0,0.0,Neutral,xrp price prediction for may 8
2024-05-09 12:00:50,SHIB Price Prediction for May 7,https://u.today/,0.0,0.0,Neutral,shib price prediction for may 7
2024-05-09 12:00:50,DOGE Price Prediction for May 7,https://u.today/,0.0,0.0,Neutral,doge price prediction for may 7
2024-05-09 12:00:50,SOL and BNB Price Prediction for May 6,https://u.today/,0.0,0.0,Neutral,sol and bnb price prediction for may 6
2024-05-09 12:00:50,Cardano Skyrockets 90% in Volume as ADA Price Makes Surprising Reversal,https://u.today/,0.7,0.2732,Positive,cardano skyrockets 90% in volume as ada price makes surprising reversal
2024-05-09 12:00:50,Shiba Inu's Shibarium Skyrockets 65% in Key Indicator of Network Activity,https://u.today/,0.0,0.0,Neutral,shiba inu's shibarium skyrockets 65% in key indicator of network activity
2024-05-09 12:00:50,Legendary Trader Peter Brandt Drops Intriguing Hint on Ethereum's (ETH) Price Action,https://u.today/,0.46666666666666673,0.0,Neutral,legendary trader peter brandt drops intriguing hint on ethereum's (eth) price action
2024-05-09 12:00:50,"It Just Got Easier to Mine Single Bitcoin (BTC), Here's Reason",https://u.today/,-0.07142857142857142,0.4215,Positive,"it just got easier to mine single bitcoin (btc), here's reason"
2024-05-09 12:00:50,"Satoshi Nakamoto Praised by Gabor Gurbacs, Here's Why",https://u.today/,0.0,0.4939,Neutral,"satoshi nakamoto praised by gabor gurbacs, here's why"
2024-05-09 12:00:50,Over 24 Million Shiba Inu (SHIB) Tokens Destroyed - Will Price Rebound?,https://u.today/,0.0,-0.4939,Positive,over 24 million shiba inu (shib) tokens destroyed - will price rebound?
2024-05-09 12:00:50,The Rothschilds Hold $4.2 Million in Bitcoin via ETFs,https://u.today/,0.0,0.0,Neutral,the rothschilds hold $4.2 million in bitcoin via etfs
2024-05-09 12:00:50,"Ethereum Loses Deflationary Status Post-Dencun Upgrade, Here's Reason",https://u.today/,-0.3,-0.3182,Negative,"ethereum loses deflationary status post-dencun upgrade, here's reason"
2024-05-09 12:00:50,Here's Why VanEck Subsidiary's Meme Coin Index Is Important for Market,https://u.today/,0.4,0.2023,Neutral,here's why vaneck subsidiary's meme coin index is important for market
2024-05-09 12:00:50,DOGE and SHIB Rival FLOKI Issues Crucial Warning to Community,https://u.today/,0.0,-0.34,Negative,doge and shib rival floki issues crucial warning to community
2024-05-09 12:00:50,"Mysterious Whale Pulls 6,030 Ethereum (ETH) From Exchange as Price Eyes $3,000",https://u.today/,0.0,0.0,Neutral,"mysterious whale pulls 6,030 ethereum (eth) from exchange as price eyes $3,000"
2024-05-09 12:00:50,"Bitcoin (BTC) Price to Dip Below $55,000, Warns Top Analyst",https://u.today/,0.5,0.1027,Negative,"bitcoin (btc) price to dip below $55,000, warns top analyst"
2024-05-09 12:00:50,Shiba Inu Secures Elite Status in Market Rankings Among Meme Coins,https://u.today/,0.0,0.3182,Positive,shiba inu secures elite status in market rankings among meme coins
2024-05-09 12:00:50,Two Major Dogecoin (DOGE) Indicators Flash 'Bullish',https://u.today/,0.0625,0.0,Positive,two major dogecoin (doge) indicators flash 'bullish'
2024-05-09 12:00:50,'Rich Dad Poor Dad' Author Kiyosaki Shares Key Bitcoin Revelation Amid Crucial Warning,https://u.today/,-0.0062500000000000056,0.0772,Negative,'rich dad poor dad' author kiyosaki shares key bitcoin revelation amid crucial warning
2024-05-09 12:00:50,357.3 Billion PEPE Purchased on Binance After Major Meme Coin Development,https://u.today/,0.0625,0.0,Neutral,357.3 billion pepe purchased on binance after major meme coin development
2024-05-09 12:00:50,Ripple v. SEC: Legal Expert Highlights Flaws in SEC's Case,https://u.today/,0.0,0.128,Negative,ripple v. sec: legal expert highlights flaws in sec's case
2024-05-09 12:00:50,Vitalik Buterin Solves Ethereum's Gas Fee Problem,https://u.today/,0.0,-0.1531,Positive,vitalik buterin solves ethereum's gas fee problem
2024-05-09 12:00:50,Arbitrum (ARB) Hits 2 Million Daily Transaction Milestone Amid Crucial Update,https://u.today/,0.0,0.0,Positive,arbitrum (arb) hits 2 million daily transaction milestone amid crucial update
2024-05-09 12:00:50,"Cardano Founder Responds to ADA Community, But With Warning",https://u.today/,0.0,-0.4767,Neutral,"cardano founder responds to ada community, but with warning"
2024-05-09 12:00:50,"XRP Becomes Most Discussed Asset on Market, Here's Why",https://u.today/,0.5,0.4173,Neutral,"xrp becomes most discussed asset on market, here's why"
2024-05-09 12:00:50,"'Not True, But Plausible': Ripple CTO Breaks Silence as to Whether He Is Satoshi",https://u.today/,0.1625,-0.1695,Neutral,"'not true, but plausible': ripple cto breaks silence as to whether he is satoshi"
2024-05-09 12:00:50,'$1 Million Bitcoin' Advocate Samson Mow Issues Bullish BTC Call: Details,https://u.today/,0.0,0.0,Positive,'$1 million bitcoin' advocate samson mow issues bullish btc call: details
2024-05-09 12:00:50,Ethereum ETF: Grayscale Boss Optimistic Ahead of Major SEC Decision,https://u.today/,-0.018750000000000003,0.3182,Positive,ethereum etf: grayscale boss optimistic ahead of major sec decision
2024-05-09 12:00:50,Musk’s AI Startup Behind Grok to Get $18 Billion Valuation. Will It Leapfrog OpenAI?,https://u.today/,-0.4,0.0,Neutral,musk’s ai startup behind grok to get $18 billion valuation. will it leapfrog openai?
2024-05-09 12:00:50,"Ethereum (ETH) on Verge of Fall, XRP Death Cross Solidifies, Solana (SOL) Breakout Could Be Fake",https://u.today/,-0.25,-0.7906,Positive,"ethereum (eth) on verge of fall, xrp death cross solidifies, solana (sol) breakout could be fake"
2024-05-09 12:00:50,SEC's Targeting of Ripple's Stablecoin Explained by Analyst,https://u.today/,-0.1,0.0,Neutral,sec's targeting of ripple's stablecoin explained by analyst
2024-05-09 12:00:50,Nigeria Rejects Binance's Bribery Accusations,https://u.today/,0.0,-0.6705,Neutral,nigeria rejects binance's bribery accusations
2024-05-09 12:00:50,"Robinhood CEO Issues Firm Response to SEC, Samson Mow Expects New BTC All-Time High Soon, SHIB Lead Shytoshi Kusama Shares Mysterious Teaser: Crypto News Digest by U.Today",https://u.today/,-0.0007272727272727375,0.0516,Neutral,"robinhood ceo issues firm response to sec, samson mow expects new btc all-time high soon, shib lead shytoshi kusama shares mysterious teaser: crypto news digest by u.today"
2024-05-09 12:00:50,Dogecoin (DOGE) Skyrockets 582% in Key Metric as Whales Tap In,https://u.today/,0.0,0.0,Neutral,dogecoin (doge) skyrockets 582% in key metric as whales tap in
2024-05-09 12:00:50,"Imminent Arrival of Stablecoins on Bitcoin, Hints Lightning Labs CEO",https://beincrypto.com/,0.0,0.0,Neutral,"imminent arrival of stablecoins on bitcoin, hints lightning labs ceo"
2024-05-09 12:00:50,Litecoin (LTC) Sees Breakout: Analyzing the Chances of a 27% Increase,https://beincrypto.com/,0.0,0.4767,Neutral,litecoin (ltc) sees breakout: analyzing the chances of a 27% increase
2024-05-09 12:00:50,"VanEck’s New MEMECOIN Index Soars by 195%, Outperforming Other Crypto Indices",https://beincrypto.com/,0.005681818181818177,0.0,Positive,"vaneck’s new memecoin index soars by 195%, outperforming other crypto indices"
2024-05-09 12:00:50,Vitalik Buterin Discusses New Plan for Ethereum Transaction Fees,https://beincrypto.com/,0.13636363636363635,0.0,Neutral,vitalik buterin discusses new plan for ethereum transaction fees
2024-05-09 12:00:50,"Bitcoin Bull Run Far From Peak, According to Analyst",https://beincrypto.com/,0.1,0.0,Neutral,"bitcoin bull run far from peak, according to analyst"
2024-05-09 12:00:50,Arbitrum (ARB) Hits 2 Million Daily Transactions as Market Bottom Looms,https://beincrypto.com/,0.0,-0.1531,Neutral,arbitrum (arb) hits 2 million daily transactions as market bottom looms
