date_scraped,headline,source
2024-05-20 00:55:44,SHIB Price Prediction for May 17,https://u.today/
2024-05-20 00:55:44,DOGE Price Prediction for May 17,https://u.today/
2024-05-20 00:55:44,"Is XRP in 'Crab Market'? Solana (SOL) Reaches Major Resistance Level Before $200, Ethereum (ETH) Really Needs This Price Level",https://u.today/
2024-05-20 00:55:44,Here's What Could Ignite New Bitcoin Rally,https://u.today/
2024-05-20 00:55:44,Michael Saylor Breaks Silence on Bitcoin (BTC) Price Pause: Details,https://u.today/
2024-05-20 00:55:44,"Binance Listing Might Be Dead End for Tokens, Shows Epic New Research",https://u.today/
2024-05-20 00:55:44,Half Trillion Shiba Inu (SHIB) in 24 Hours: Is Shiba Inu (SHIB) Hiding Something?,https://u.today/
2024-05-20 00:55:44,"Dogwifhat (WIF), PEPE and Other Meme Coins Eye Epic Dump Amid Market Chaos",https://u.today/
2024-05-20 00:55:44,"Shiba Inu (SHIB) Surges 3,015% in NetFlow Spike, but There's Catch",https://u.today/
2024-05-20 00:55:44,Mysterious $1.9 Billion Solana (SOL) Transfer Turns Heads,https://u.today/
2024-05-20 00:55:44,Legendary Trader Peter Brandt Reveals What's Behind 'Bitcoin Is Dead' Claim of Peter Schiff,https://u.today/
2024-05-20 00:55:44,"Bitcoin Is Dead, Peter Schiff Claims",https://u.today/
2024-05-20 00:55:44,"Vitalik Buterin's Ethereum Statement Raises Rumbling on X, Here's Why",https://u.today/
2024-05-20 00:55:44,Bitcoin Holder Sends 90% of BTC Stash to Satoshi Nakamoto in Shocking Error,https://u.today/
2024-05-20 00:55:44,Is Tether Getting Delisted on Kraken? Top Exchange Issues Statement,https://u.today/
2024-05-20 00:55:44,'Binance Pump' Doesn't Exist Anymore as Listed Tokens Mostly Lose Value,https://u.today/
2024-05-20 00:55:44,Ripple CEO “Particularly Excited” About Native AMMs,https://u.today/
2024-05-20 00:55:44,"Whopping 97% Transaction Count Plunge Faced by Shibarium, What's Happening?",https://u.today/
2024-05-20 00:55:44,Ripple v. SEC: What's Next as Legal Battle Rages On,https://u.today/
2024-05-20 00:55:44,Shiba Inu Targets $0.00005: Can 106 Trillion SHIB Break Even?,https://u.today/
2024-05-20 00:55:44,"Mysterious 7,000 ETH Move to Robinhood as Ethereum Tops $3,000",https://u.today/
2024-05-20 00:55:44,"Over 50 Million USDT Blacklisted by Tether, What Happened?",https://u.today/
2024-05-20 00:55:44,Ripple Reveals Impressive Q1 XRP Growth in New Report,https://u.today/
2024-05-20 00:55:44,Solana (SOL) Ranked Fastest Blockchain: Details,https://u.today/
2024-05-20 00:55:44,DOGE Community Reacts to New X Payments Promise to Launch This Year,https://u.today/
2024-05-20 00:55:44,"Shiba Inu (SHIB) Eyes Dramatic Rebound, One Obstacle Looms",https://u.today/
2024-05-20 00:55:44,Shibarium: Grok’s Insight on TREAT Unveiled by Shiba Inu Insider,https://u.today/
2024-05-20 00:55:44,Vitalik Buterin Addresses Major Concerns by Ethereum Community,https://u.today/
2024-05-20 00:55:44,Bitcoin Saving Your Money: Michael Saylor Makes Fundamentally Bullish Statement,https://u.today/
2024-05-20 00:55:44,"XRP Ledger (XRPL) Transactions in Q1 Jump 108%, but With Catch",https://u.today/
2024-05-20 00:55:44,DOGE Price Soars 4.45% With 120 Million Dogecoin Mysteriously Sent to Robinhood,https://u.today/
2024-05-20 00:55:44,"XRP Really Needs That Breakout, Ethereum (ETH) Is Hiding Something, Nothing Stops Bitcoin (BTC) Before $71,000",https://u.today/
2024-05-20 00:55:44,"User Loses $7,000 in BTC After Sending to Satoshi Nakamoto’s Address by Mistake",https://beincrypto.com/
2024-05-20 00:55:44,Ethereum Foundation’s Justin Drake Takes on Critical Advisory Position at EigenLayer,https://beincrypto.com/
2024-05-20 00:55:44,Researcher: Binance Token Listing Now Serves as Exit Liquidity for Venture Capital Firms,https://beincrypto.com/
2024-05-20 00:55:44,High Energy Consumption Forces Venezuela to Disconnect Crypto Mining Farms,https://beincrypto.com/
2024-05-20 00:55:44,AntPool’s Streak of 7 Consecutive Blocks Sparks Centralization Fears in Bitcoin Mining,https://beincrypto.com/
2024-05-20 00:55:44,"Meme Coin Degen Flips $2,275 to $2.26 Million Amid Others’ Losses",https://beincrypto.com/
2024-05-20 00:55:44,Alleged Pump.fun Exploiter Has Been Nabbed in London,https://www.cryptotimes.io/category/market-news/
2024-05-20 00:55:44,Vitalik Buterin Advocates for Free Speech in Crypto Space,https://www.cryptotimes.io/category/market-news/
2024-05-20 00:55:44,Phantom Wallet Soars to #3 on App Store,https://www.cryptotimes.io/category/market-news/
2024-05-20 00:55:44,BingX Joins GM Vietnam 2024 as Diamond Sponsor,https://www.cryptotimes.io/category/market-news/
2024-05-20 00:55:44,Kraken Stays Firm on Tether Support Amid Regulation,https://www.cryptotimes.io/category/market-news/
2024-05-20 00:55:44,ABCON Seeks SEC Oversight on Forex P2P,https://www.cryptotimes.io/category/market-news/
2024-05-20 00:55:44,Microsoft Might Face EU Probe Over Bing AI Safety Concerns,https://www.cryptotimes.io/category/market-news/
2024-05-20 00:55:44,Venezuela Halts Crypto Mining to Ensure Reliable Power Supply,https://www.cryptotimes.io/category/market-news/
2024-05-20 00:55:44,Defi TVL Hits $94.974B with $11.89B Increase,https://www.cryptotimes.io/category/market-news/
2024-05-20 00:55:44,Tether’s Plan for P2P Financial Markets Terminal,https://www.cryptotimes.io/category/market-news/
2024-05-20 00:55:44,Pendle Token Theft Surges as $5.62 Million Lost in Phishing,https://www.cryptotimes.io/category/market-news/
2024-05-20 00:55:44,MakerDAO Launches PureDAI and NewStable Stablecoins,https://www.cryptotimes.io/category/market-news/
2024-05-20 00:55:44,Australian Admits Role in BitConnect Ponzi Scheme Promotion,https://www.cryptotimes.io/category/market-news/
2024-05-20 00:55:44,LayerZero Unmasks 800K Fraudulent Addresses in Sybil Report,https://www.cryptotimes.io/category/market-news/
2024-05-20 00:55:44,Changpeng Zhao ‘CZ’ Plans to “Write Something” in Prison,https://www.cryptotimes.io/category/market-news/
2024-05-20 00:55:44,Fantom’s FTM Price Surge After Unveiling Sonic Network,https://www.cryptotimes.io/category/market-news/
2024-05-20 00:55:44,"Terrorists Exploit Young Nigerian Crypto Traders, EFCC Warns",https://www.cryptotimes.io/category/market-news/
2024-05-20 00:55:44,Gamety: Innovative Blockchain Gaming Platform,https://www.cryptotimes.io/category/market-news/
2024-05-20 00:55:44,Genesis Global Returns $3 Billion to Crypto Clients,https://www.cryptotimes.io/category/market-news/
2024-05-20 00:55:44,Ghana and Singapore Semi-Fungible Token Trade Trial,https://www.cryptotimes.io/category/market-news/
2024-05-20 00:55:44,Alex Labs Recovers $3.9M in Crypto After Bridge Exploit,https://www.cryptotimes.io/category/market-news/
2024-05-20 00:55:44,Telegram Founder’s $7M Notcoin Donation Sparks Controversy,https://www.cryptotimes.io/category/market-news/
2024-05-20 00:55:44,Two Chinese Nationals Charged in $73m Crypto Laundering,https://www.cryptotimes.io/category/market-news/
2024-05-20 00:55:44,Bitfinity Integrates EVM for Bitcoin DeFi with Runes,https://www.cryptotimes.io/category/market-news/
2024-05-20 00:55:44,BOX-GameFi: Blockchain Gaming Reimagined,https://www.cryptotimes.io/category/market-news/
2024-05-20 00:55:44,ZkSync’s v24 Upgrade Sets Stage for Potential June Airdrop,https://www.cryptotimes.io/category/market-news/
2024-05-20 00:55:44,Tether’s $1 Billion USDT Minting Fuels Bitcoin Surge,https://www.cryptotimes.io/category/market-news/
2024-05-20 00:55:44,Crypto Influencer T.J. Stone Pleads Guilty to Wire Fraud Charges,https://www.cryptotimes.io/category/market-news/
2024-05-20 00:55:44,Kraken Actively Reviewing Tether Amid New EU Crypto Rules,https://www.cryptotimes.io/category/market-news/
2024-05-20 00:55:44,Magic Launchpad Unveiled for Web3 Investors,https://www.cryptotimes.io/category/market-news/
2024-05-21 00:55:14,Bitcoin Reaches Highest Price Since April Halving,https://decrypt.co/
2024-05-21 00:55:14,GameStop Meme Coin Plunges as GME Fever Fades,https://decrypt.co/
2024-05-21 00:55:14,Infamous Scam Service Pink Drainer Says It's Retiring After Stealing $75 Million—But Shows No Remorse,https://decrypt.co/
2024-05-21 00:55:14,Binance Exec Tigran Gambaryan Denied Bail by Nigerian Court,https://decrypt.co/
2024-05-21 00:55:14,"Institutional Investors Still Don't Believe a Bitcoin Rally Is Imminent, According to CME Options Data",https://decrypt.co/
2024-05-21 00:55:14,Solana Restaking Protocol Solayer Reaches $20 Million Deposit Cap in 45 Minutes,https://decrypt.co/
2024-05-21 00:55:14,Notcoin's NOT Token Has Largest Gaming Token Launch of 2024,https://decrypt.co/
2024-05-21 00:55:14,Tornado Cash Dev Alexey Pertsev Appeals Money Laundering Conviction,https://decrypt.co/
2024-05-21 00:55:14,CME Group Wants to Offer Spot Bitcoin Trading,https://decrypt.co/
2024-05-21 00:55:14,Bitcoin and Dogecoin Prices Surge In Wake of GameStop Meme Stock Rally,https://decrypt.co/
2024-05-21 00:55:14,New Launch Date for BLAST Token Airdrop Set by Ethereum Layer-2 Scaling Network,https://decrypt.co/
2024-05-21 00:55:14,The Apparent Return of Roaring Kitty Has Sent Stock and Crypto Markets Into a Frenzy—But Is Keith Gill Really Back?,https://decrypt.co/
2024-05-21 00:55:14,"Bitcoin Booster Salim Ramji Now Heads Vanguard, Broadening Crypto's Reach on Wall Street",https://decrypt.co/
2024-05-21 00:55:14,Feds Arrest Crypto Bros for Stealing $25 Million In 12 Seconds,https://decrypt.co/
2024-05-21 00:55:14,Nyan Heroes Will Launch Its NYAN Token on Solana Next Week,https://decrypt.co/
2024-05-21 00:55:14,Is the SEC’s expected spot ether ETF denial priced in?,https://blockworks.co/category/markets
2024-05-21 00:55:14,"Cryptocurrencies rally, stocks trade sideways as traders speculate interest rate decision",https://blockworks.co/category/markets
2024-05-21 00:55:14,"Bitcoin is back above $60K, stocks rally on cooler jobs data",https://blockworks.co/category/markets
2024-05-21 00:55:14,"Fed holds interest rates, markets hardly react",https://blockworks.co/category/markets
2024-05-21 00:55:14,"Cryptocurrencies, stocks slide ahead of Fed rate decision",https://blockworks.co/category/markets
2024-05-21 00:55:14,"Stocks bounce, cryptocurrencies trade sideways despite disappointing inflation data",https://blockworks.co/category/markets
2024-05-21 00:55:14,"Cryptocurrencies, equities slide on slowing economic growth",https://blockworks.co/category/markets
2024-05-21 00:55:14,"BlackRock’s bitcoin ETF inflows halt after 71-day streak, data shows",https://blockworks.co/category/markets
2024-05-21 00:55:14,"Bitcoin hovers around $63,600 following the halving",https://blockworks.co/category/markets
2024-05-21 00:55:14,Bitcoin’s block reward slashed by 50% following 2024 halving,https://blockworks.co/category/markets
2024-05-21 00:55:14,Bitcoin ETF segment sees record-tying fifth straight day of outflows,https://blockworks.co/category/markets
2024-05-21 00:55:14,How the Bitcoin halving could impact ailing mining stocks,https://blockworks.co/category/markets
2024-05-21 00:55:14,Bitcoin dips below $60K as pre-halving volatility reigns,https://blockworks.co/category/markets
2024-05-21 00:55:14,Cryptos slip as Powell doubles-down on delaying rate cuts,https://blockworks.co/category/markets
2024-05-21 00:55:14,Solana price falls further as Ore suspends mining on the network,https://blockworks.co/category/markets
2024-05-21 00:55:14,Spot bitcoin ETF flows turn positive again as GBTC outflows taper,https://blockworks.co/category/markets
2024-05-21 00:55:14,Cryptocurrencies slip while stocks bounce on red-hot jobs data,https://blockworks.co/category/markets
2024-05-21 00:55:14,"Cryptocurrencies, stocks bounce as Powell calms traders",https://blockworks.co/category/markets
2024-05-21 00:55:14,"Bitcoin, ether kick off Q2 in the red as halving approaches",https://blockworks.co/category/markets
2024-05-21 00:55:14,Solana breaks $200 as memecoin and airdrop interest continue,https://blockworks.co/category/markets
2024-05-21 00:55:14,"Bitcoin back above $70K, crypto stocks follow suit",https://blockworks.co/category/markets
2024-05-21 00:55:14,Bitcoin ETF snapshot: Net outflow run hits five days for the first time,https://blockworks.co/category/markets
2024-05-21 00:55:14,"Bitcoin ETF net outflows streak hits four days, $836 million",https://blockworks.co/category/markets
2024-05-21 00:55:14,"Cryptos, stocks slide as markets brace for upcoming Fed decision",https://blockworks.co/category/markets
2024-05-21 00:55:14,"Ether ETFs Filing Process Sees Abrupt Progress, Though Approval Not Guaranteed: Sources",https://www.coindesk.com/
2024-05-21 00:55:14,Bitcoin Breaks Out Above $68K as Solana's 7% Gain Leads Crypto Rally,https://www.coindesk.com/
2024-05-21 00:55:14,"Phemex Promises Market-Beating Borrowing Rates With Its New Lending Protocol, Elevates Engagement to New Heights With Pulse Season 3",https://www.coindesk.com/
2024-05-21 00:55:14,"Phemex Promises Market-Beating Borrowing Rates With Its New Lending Protocol, Elevates Engagement to New Heights With Pulse Season 3",https://www.coindesk.com/
2024-05-21 00:55:14,Ether Jumps 10% to $3.4K After Bloomberg Ups Odds of Spot ETF Approval,https://www.coindesk.com/
2024-05-21 00:55:14,"Grayscale CEO Michael Sonnenshein Steps Down, to Be Replaced by TradFi Veteran",https://www.coindesk.com/
2024-05-21 00:55:14,"Craig Wright Lied to UK Court 'Extensively and Repeatedly,' Judge Writes",https://www.coindesk.com/
2024-05-21 00:55:14,Gaming Token Gala Drops Amid Suspect $200M Transfer,https://www.coindesk.com/
2024-05-21 00:55:14,"Will RFK Jr. Debate Trump or Biden? Probably Not, Prediction Market Says",https://www.coindesk.com/
2024-05-21 00:55:14,"Shiba Inu (SHIB) Delivers Devastating Performance, Solana (SOL) Performs Massive Breakthrough, Is Ethereum (ETH) Ready For Bullish Market?",https://u.today/
2024-05-21 00:55:14,Ethereum ETF Approval Odds Suddenly Surge. Here's Why,https://u.today/
2024-05-21 00:55:14,Bitcoin Bulls Push BTC Price Past $68K. Is $70K Next?,https://u.today/
2024-05-21 00:55:14,Vitalik Buterin Shares Rare Ethereum (ETH) Roadmap Update,https://u.today/
2024-05-21 00:55:14,Cardano: 21 Billion ADA Shifted in Anticipation of Major Price Boost,https://u.today/
2024-05-21 00:55:14,"Peter Brandt Urges to Ignore Peter Schiff's 'Bitcoin Is Dead' Claim, Half Trillion SHIB Moved in 24 Hours, 7,000 ETH Mysteriously Moved to Robinhood: Crypto News Digest by U.Today",https://u.today/
2024-05-21 00:55:14,Shiba Inu: 58 Trillion SHIB Sparks Bull-Bear Faceoff,https://u.today/
2024-05-21 00:55:14,Elon Musk's X App's Major AI Transition Triggers Community's Enthusiasm,https://u.today/
2024-05-21 00:55:14,Binance Issues Important Update on Token Listing Strategy: Details,https://u.today/
2024-05-21 00:55:14,Dogecoin (DOGE) Faces Whale Drama as Key Metric Drops 86%,https://u.today/
2024-05-21 00:55:14,Ripple v. SEC: Day for Final Submission in Remedies Phase Arrives,https://u.today/
2024-05-21 00:55:14,Bitcoin and Cardano Skyrocket With 716% Increase in Fund Flows,https://u.today/
2024-05-21 00:55:14,SHIB Team Strikes Community With Important Message Coming Through Centuries,https://u.today/
2024-05-21 00:55:14,DOGE and SHIB Price Prediction for May 20,https://u.today/
2024-05-21 00:55:14,Solana (SOL) Ready for $200? Enormous Breakthrough Evaluated,https://u.today/
2024-05-21 00:55:14,Ripple Transfers 50 Million XRP Tokens - What's Happening?,https://u.today/
2024-05-21 00:55:14,Grayscale CEO Steps Down: Details,https://u.today/
2024-05-21 00:55:14,"BTC, ETH and XRP Price Prediction for May 20",https://u.today/
2024-05-21 00:55:14,Satoshi Mystery: Court Releases Final Ruling in Craig Wright Lawsuit,https://u.today/
2024-05-21 00:55:14,LayerZero (ZRO) Token of Omnichain Ecosystem Scores Bitget Listing Pre-Market,https://u.today/
2024-05-21 00:55:14,"Shiba Inu (SHIB) Delivers Devastating Performance, Solana (SOL) Performs Massive Breakthrough, Is Ethereum (ETH) Ready For Bullish Market?",https://u.today/
2024-05-21 00:55:14,Ethereum ETF Approval Odds Suddenly Surge. Here's Why,https://u.today/
2024-05-21 00:55:14,Bitcoin Bulls Push BTC Price Past $68K. Is $70K Next?,https://u.today/
2024-05-21 00:55:14,Vitalik Buterin Shares Rare Ethereum (ETH) Roadmap Update,https://u.today/
2024-05-21 00:55:14,Cardano: 21 Billion ADA Shifted in Anticipation of Major Price Boost,https://u.today/
2024-05-21 00:55:14,What Berkshire's Holdings Can Tell Us About Bitcoin's Future Price,https://u.today/
2024-05-21 00:55:14,Do Traditional Investors See Bitcoin as Risk Asset?,https://u.today/
2024-05-21 00:55:14,Bitcoin and S&P 500: Are Crypto and Stock Markets Still Unrelated?,https://u.today/
2024-05-21 00:55:14,"Challenges of Web3 Education, Solidity Engineers Training and First Free Guide on ZK Tech: Interview With RareSkills Founder Jeffrey Scholz",https://u.today/
2024-05-21 00:55:14,Inflows vs Outflows: Will Bitcoin ETFs Lose Momentum?,https://u.today/
2024-05-21 00:55:14,CryptoGames Integrates Polygon (MATIC) for Enhanced User Experience,https://u.today/
2024-05-21 00:55:14,Fairspin Unveils TFS Token: The Game-Changer in iGaming,https://u.today/
2024-05-21 00:55:14,"Solana Meme Coin Penguiana Hits Softcap As The Presale Raises Over 1500 SOL, Set To Release P2E Game Demo Next Month",https://u.today/
2024-05-21 00:55:14,"Aleph Zero Launches Alephoria: Exciting Airdrops, Tournaments, and Rewards Await Users",https://u.today/
2024-05-21 00:55:14,COMEX 2024 Features 24 Elements,https://u.today/
2024-05-21 00:55:14,Mining Now Launches Real-Time Mining Insights & Profit Analysis Platform,https://u.today/
2024-05-21 00:55:14,LBank Labs and IR4Lab Forge Strategic Partnership to Propel Saudi Arabia's Tech Ecosystem at LEAP 2024,https://u.today/
2024-05-21 00:55:14,Leading Voices in Fintech Gather for London’s Most Anticipated Event,https://u.today/
2024-05-21 00:55:14,Sealana: Can the Chubby Seal Move From Mom’s Basement to Top Meme Coin Rankings?,https://u.today/
2024-05-21 00:55:14,Viral Dogeverse Presale Nears $13M – Chain-Hopping Cosmo Brings Multibridge Utilities,https://u.today/
2024-05-21 00:55:14,WienerAI: The Viral New Meme Coin Reignites AI Crypto Frenzy With Sausage Army,https://u.today/
2024-05-21 00:55:14,Multichain Meme Coin Dogeverse Hits $10M in Presale – Is it Too Late to Buy?,https://u.today/
2024-05-21 00:55:14,Traders Remain Bullish on Bitcoin Despite BTC Breaking Triangle Pattern; Are These Meme Coins a Good Buy On the Pullback?,https://u.today/
2024-05-21 00:55:14,"New Memecoin GODLEN Emerges, As BOME & DogWifHat Are Chasing New Gains",https://u.today/
2024-05-21 00:55:14,Stakingfarm Introduces New Passive Income Tools,https://u.today/
2024-05-21 00:55:14,"99Bitcoins Launches Presale – Learn-to-Earn Platform Raises $100,000 in a Flash",https://u.today/
2024-05-21 00:55:14,Phoenix Introduces Yield Platform with USDC Payouts: Review,https://u.today/
2024-05-21 00:55:14,Yield App Offers Easy-to-Use Crypto Wealth Platform: Review,https://u.today/
2024-05-21 00:55:14,New-Gen Crypto Mining Ecosystem in 2024: Case of ViaBTC,https://u.today/
2024-05-21 00:55:14,LayerZero (ZRO) Token of Omnichain Ecosystem Scores Bitget Listing Pre-Market,https://u.today/
2024-05-21 00:55:14,Magic Square Launches Fundraising Platform for Web3 Projects,https://u.today/
2024-05-21 00:55:14,droppGroup Introduces droppLink Platform for AI Resource Tokenization,https://u.today/
2024-05-21 00:55:14,"Shiba Inu (SHIB) Delivers Devastating Performance, Solana (SOL) Performs Massive Breakthrough, Is Ethereum (ETH) Ready For Bullish Market?",https://u.today/
2024-05-21 00:55:14,"Is XRP in 'Crab Market'? Solana (SOL) Reaches Major Resistance Level Before $200, Ethereum (ETH) Really Needs This Price Level",https://u.today/
2024-05-21 00:55:14,"XRP Really Needs That Breakout, Ethereum (ETH) Is Hiding Something, Nothing Stops Bitcoin (BTC) Before $71,000",https://u.today/
2024-05-21 00:55:14,"Shiba Inu (SHIB) Delivers Devastating Performance, Solana (SOL) Performs Massive Breakthrough, Is Ethereum (ETH) Ready For Bullish Market?",https://u.today/
2024-05-21 00:55:14,"Is XRP in 'Crab Market'? Solana (SOL) Reaches Major Resistance Level Before $200, Ethereum (ETH) Really Needs This Price Level",https://u.today/
2024-05-21 00:55:14,"XRP Really Needs That Breakout, Ethereum (ETH) Is Hiding Something, Nothing Stops Bitcoin (BTC) Before $71,000",https://u.today/
2024-05-21 00:55:14,DOGE and SHIB Price Prediction for May 20,https://u.today/
2024-05-21 00:55:14,"BTC, ETH and XRP Price Prediction for May 20",https://u.today/
2024-05-21 00:55:14,Solana (SOL) Price Prediction for May 19,https://u.today/
2024-05-21 00:55:14,Bitcoin (BTC) Price Prediction for May 19,https://u.today/
2024-05-21 00:55:14,XRP Price Prediction for May 18,https://u.today/
2024-05-21 00:55:14,Cardano (ADA) Price Prediction for May 18,https://u.today/
2024-05-21 00:55:14,"Shiba Inu (SHIB) Delivers Devastating Performance, Solana (SOL) Performs Massive Breakthrough, Is Ethereum (ETH) Ready For Bullish Market?",https://u.today/
2024-05-21 00:55:14,Ethereum ETF Approval Odds Suddenly Surge. Here's Why,https://u.today/
2024-05-21 00:55:14,Bitcoin Bulls Push BTC Price Past $68K. Is $70K Next?,https://u.today/
2024-05-21 00:55:14,Vitalik Buterin Shares Rare Ethereum (ETH) Roadmap Update,https://u.today/
2024-05-21 00:55:14,Cardano: 21 Billion ADA Shifted in Anticipation of Major Price Boost,https://u.today/
2024-05-21 00:55:14,"Peter Brandt Urges to Ignore Peter Schiff's 'Bitcoin Is Dead' Claim, Half Trillion SHIB Moved in 24 Hours, 7,000 ETH Mysteriously Moved to Robinhood: Crypto News Digest by U.Today",https://u.today/
2024-05-21 00:55:14,Shiba Inu: 58 Trillion SHIB Sparks Bull-Bear Faceoff,https://u.today/
2024-05-21 00:55:14,Elon Musk's X App's Major AI Transition Triggers Community's Enthusiasm,https://u.today/
2024-05-21 00:55:14,Binance Issues Important Update on Token Listing Strategy: Details,https://u.today/
2024-05-21 00:55:14,Dogecoin (DOGE) Faces Whale Drama as Key Metric Drops 86%,https://u.today/
2024-05-21 00:55:14,Ripple v. SEC: Day for Final Submission in Remedies Phase Arrives,https://u.today/
2024-05-21 00:55:14,Bitcoin and Cardano Skyrocket With 716% Increase in Fund Flows,https://u.today/
2024-05-21 00:55:14,SHIB Team Strikes Community With Important Message Coming Through Centuries,https://u.today/
2024-05-21 00:55:14,Solana (SOL) Ready for $200? Enormous Breakthrough Evaluated,https://u.today/
2024-05-21 00:55:14,Ripple Transfers 50 Million XRP Tokens - What's Happening?,https://u.today/
2024-05-21 00:55:14,Grayscale CEO Steps Down: Details,https://u.today/
2024-05-21 00:55:14,Satoshi Mystery: Court Releases Final Ruling in Craig Wright Lawsuit,https://u.today/
2024-05-21 00:55:14,"'Bitcoin Prize' Tweet Issued by Michael Saylor, Here's His Price Hint",https://u.today/
2024-05-21 00:55:14,XRP Skyrockets 93% in Volume Amid Painful Bull Liquidation,https://u.today/
2024-05-21 00:55:14,Satoshi Nakamoto Just Received Unsolicited Gift: Details,https://u.today/
2024-05-21 00:55:14,Litecoin (LTC) Whales Waking Up: Details,https://u.today/
2024-05-21 00:55:14,2 Trillion Shiba Inu (SHIB) in 24 Hours: Shiba Inu (SHIB) on Verge of Surge?,https://u.today/
2024-05-21 00:55:14,"Ethereum (ETH) Nears Key Breakout, Eyes $4,000 Target",https://u.today/
2024-05-21 00:55:14,Ripple CTO Explains Why They Are Biggest XRP Sellers,https://u.today/
2024-05-21 00:55:14,Dogecoin Founder Issues Important Malware Warning to Advertisers,https://u.today/
2024-05-21 00:55:14,SHIB Burns On Fire Despite Shiba Inu Price Going Down,https://u.today/
2024-05-21 00:55:14,Bitcoin (BTC) Makes Crucial Move,https://u.today/
2024-05-21 00:55:14,SEC to Finally Make Decision Regarding Ethereum ETFs This Week,https://u.today/
2024-05-21 00:55:14,Linux Inventor Says He Doesn’t Believe in Crypto,https://u.today/
2024-05-21 00:55:14,"Is XRP in 'Crab Market'? Solana (SOL) Reaches Major Resistance Level Before $200, Ethereum (ETH) Really Needs This Price Level",https://u.today/
2024-05-21 00:55:14,Bitcoin (BTC) Bounces Back: Key Trends to Watch,https://beincrypto.com/
2024-05-21 00:55:14,"Vitalik Buterin Discusses Ethereum’s MEV, Staking, and Node Hardware Issues",https://beincrypto.com/
2024-05-21 00:55:14,Shiba Inu (SHIB) Bullish Breakout at Risk of Fading,https://beincrypto.com/
2024-05-21 00:55:14,GNO Token Gains 20% as Gnosis DAO Proposes $30 Million Buyback,https://beincrypto.com/
2024-05-21 00:55:14,Dogwifhat (WIF) Price Fails Bullish Outcome Despite Recent Rally,https://beincrypto.com/
2024-05-21 00:55:14,UK High Court Exposes Craig Wright’s Fraudulent Bitcoin Inventor Claims,https://beincrypto.com/
2024-05-21 00:55:14,Brazil Central Bank Delays Crypto Regulation Implementation,https://www.cryptotimes.io/category/market-news/
2024-05-21 00:55:14,Ex-Congressman Kendrick Meek joins Coinbase’s Crypto Council,https://www.cryptotimes.io/category/market-news/
2024-05-21 00:55:14,Taiwanese National Arrested for Running Dark Web Drug Market,https://www.cryptotimes.io/category/market-news/
2024-05-21 00:55:14,Astar Studio Launches Developer Platform for Astar zkEVM,https://www.cryptotimes.io/category/market-news/
2024-05-21 00:55:14,Blockchain Association Pushes for House Vote on FIT21 Act,https://www.cryptotimes.io/category/market-news/
2024-05-21 00:55:14,XLink Partners with Kaamel and Others After $10M Breach,https://www.cryptotimes.io/category/market-news/
2024-05-21 00:55:14,Judge Rules Craig Wright Guilty of Forgery in Satoshi Claims,https://www.cryptotimes.io/category/market-news/
2024-05-21 00:55:14,Genesis to Pay $2 Billion for NY Investor Loss Compensation,https://www.cryptotimes.io/category/market-news/
2024-05-21 00:55:14,Gnosis Token Surges 20% After Thanefield’s $30M Buyback Proposal,https://www.cryptotimes.io/category/market-news/
2024-05-21 00:55:14,U.K. Court Allows Wikileaks’ Founder Julian Assange To Appeal Extradition,https://www.cryptotimes.io/category/market-news/
