date_scraped,headline,source
2024-06-09 01:01:42,Ancient $21.9m Ethereum Whale Awakens After 9 Years,https://www.cryptotimes.io/category/market-news/
2024-06-09 01:01:42,Traders View Crypto Market Downturn as Short-Term “Shakeout”,https://www.cryptotimes.io/category/market-news/
2024-06-09 01:01:42,Potential Juror Misconduct in Trump Trial Raises Concerns,https://www.cryptotimes.io/category/market-news/
2024-06-09 01:01:42,Crypto Data Platform CoinGecko Gets Hit By Data Breach,https://www.cryptotimes.io/category/market-news/
2024-06-09 01:01:42,Bakkt Holdings Considers Breakup Amid Financial Challenges,https://www.cryptotimes.io/category/market-news/
2024-06-09 01:01:42,HKMA Alerts Public of Unregulated ‘Kucoin’ Crypto Scam,https://www.cryptotimes.io/category/market-news/
2024-06-09 01:01:42,OKX’s Program Testing Spike Bitcoin Network Fees,https://www.cryptotimes.io/category/market-news/
2024-06-09 01:01:42,DeFi TVL Reaches $192B in May Amid Decline in Active Wallets,https://www.cryptotimes.io/category/market-news/
2024-06-09 01:01:42,Trump Calls Himself as ‘Crypto President’ at San Francisco Fundraiser,https://www.cryptotimes.io/category/market-news/
2024-06-09 01:01:42,Base Beats OP Mainnet to Become Largest L2 Superchain,https://www.cryptotimes.io/category/market-news/
2024-06-09 01:01:42,Bitget Launches Exclusive Offer For New European Users,https://www.cryptotimes.io/category/market-news/
2024-06-09 01:01:42,Norwegian Government Recovers $5.7M in Ronin Bridge Cyber Attack,https://www.cryptotimes.io/category/market-news/
2024-06-09 01:01:42,Alchemy Pay Integrates USDt on TON for Seamless Transaction,https://www.cryptotimes.io/category/market-news/
2024-06-09 01:01:42,Breaking News: Nasdaq Halts Trading for GameStop Stocks,https://www.cryptotimes.io/category/market-news/
2024-06-09 01:01:42,Bitdeer’s Chief Business Officer Unveils SEALMINER R&D Plan,https://www.cryptotimes.io/category/market-news/
2024-06-09 01:01:42,Former Officials Unite to Free Binance Exec in Nigeria,https://www.cryptotimes.io/category/market-news/
2024-06-09 01:01:42,Elon Musk’s Deepfake Scam Floods YouTube During SpaceX Launch,https://www.cryptotimes.io/category/market-news/
2024-06-09 01:01:42,MicroStrategy Faces $6.9B Bet Against Stock from Big Shorts,https://www.cryptotimes.io/category/market-news/
2024-06-09 01:01:42,Ripple Executive Rips Apart SEC Over Waste of Taxpayers’ Dollars,https://www.cryptotimes.io/category/market-news/
2024-06-09 01:01:42,Bitdeer Acquires FreeChain in 20M Share Deal to Boost ASIC,https://www.cryptotimes.io/category/market-news/
2024-06-09 01:01:42,New York AG Sues NovaTech and AWS Mining for $1B Fraud,https://www.cryptotimes.io/category/market-news/
2024-06-09 01:01:42,Binance Resumes Mastercard Payments to buy Crypto,https://www.cryptotimes.io/category/market-news/
2024-06-09 01:01:42,Unstoppable and Blockchain.com Collaborate for Web3 Domains,https://www.cryptotimes.io/category/market-news/
2024-06-09 01:01:42,Bybit Opens Trading for Overseas Chinese Community,https://www.cryptotimes.io/category/market-news/
2024-06-09 01:01:42,Telegram Launches Telegram Stars A New Payment System,https://www.cryptotimes.io/category/market-news/
2024-06-09 01:01:42,Pantera Invest $21 million in Mezo’s Bitcoin DeFi Push,https://www.cryptotimes.io/category/market-news/
2024-06-09 01:01:42,Solana Developer Suffers Severe Burns in Stunt for Meme Coin,https://www.cryptotimes.io/category/market-news/
2024-06-10 00:59:08,"$237 Million Arbitrum Gaming Proposal Passes, But Some Demand a Revote",https://decrypt.co/
2024-06-10 00:59:08,"A Large Exchange Is Tidying Up Its Wallet, Sending Bitcoin Fees Surging",https://decrypt.co/
2024-06-10 00:59:08,Bybit Opens Its Doors to Chinese Citizens Living Outside of Mainland China,https://decrypt.co/
2024-06-10 00:59:08,"Bitcoin and Ethereum Prices Plummet, Triggering Nearly $300 Million in Liquidations",https://decrypt.co/
2024-06-10 00:59:08,BitMEX Co-Founder Says Interest Rate Cuts Will Fire Up the Crypto Market,https://decrypt.co/
2024-06-10 00:59:08,Bitcoin's Price Dipped After Employment Stats Suggest Delayed Interest Rate Cuts,https://decrypt.co/
2024-06-10 00:59:08,GameStop's Stock Drops As GME Meme Coin on Solana Reaches All-Time High,https://decrypt.co/
2024-06-10 00:59:08,Robinhood Acquisition of Bitstamp Allows It to Compete With Coinbase and Kraken,https://decrypt.co/
2024-06-10 00:59:08,Donald Trump Strategically Embraces Bitcoin and Crypto to Contrast Biden's Hostility,https://decrypt.co/
2024-06-10 00:59:08,"Semler Scientific Buys $17M in BTC, Plans Up to $150M More",https://decrypt.co/
2024-06-10 00:59:08,"Bitcoin Could Rally to $83,000 If U.S. Payroll Data Is Favorable",https://decrypt.co/
2024-06-10 00:59:08,Feds File Charges Against Trio for $3 Million ‘Evolved Apes’ NFT Game Scam,https://decrypt.co/
2024-06-10 00:59:08,New York Attorney General Sues Crypto Scammers for $1 Billion Take,https://decrypt.co/
2024-06-10 00:59:08,Hamster Kombat Draws Over 100 Million Players As Token Launch Date Nears,https://decrypt.co/
2024-06-10 00:59:08,Telegram Introduces Stars As In-App Currency for Telegram Apps,https://decrypt.co/
2024-06-10 00:59:08,"Hotter-than-expected jobs report shows mixed bag, markets dip",https://blockworks.co/category/markets
2024-06-10 00:59:08,Mt Gox distributions may not be all doom and gloom for bitcoin,https://blockworks.co/category/markets
2024-06-10 00:59:08,"Ether, bitcoin rally on renewed ETH ETF optimism",https://blockworks.co/category/markets
2024-06-10 00:59:08,Is the SEC’s expected spot ether ETF denial priced in?,https://blockworks.co/category/markets
2024-06-10 00:59:08,"Cryptocurrencies rally, stocks trade sideways as traders speculate interest rate decision",https://blockworks.co/category/markets
2024-06-10 00:59:08,"Bitcoin is back above $60K, stocks rally on cooler jobs data",https://blockworks.co/category/markets
2024-06-10 00:59:08,"Fed holds interest rates, markets hardly react",https://blockworks.co/category/markets
2024-06-10 00:59:08,"Cryptocurrencies, stocks slide ahead of Fed rate decision",https://blockworks.co/category/markets
2024-06-10 00:59:08,"Stocks bounce, cryptocurrencies trade sideways despite disappointing inflation data",https://blockworks.co/category/markets
2024-06-10 00:59:08,"Cryptocurrencies, equities slide on slowing economic growth",https://blockworks.co/category/markets
2024-06-10 00:59:08,"BlackRock’s bitcoin ETF inflows halt after 71-day streak, data shows",https://blockworks.co/category/markets
2024-06-10 00:59:08,"Bitcoin hovers around $63,600 following the halving",https://blockworks.co/category/markets
2024-06-10 00:59:08,Bitcoin’s block reward slashed by 50% following 2024 halving,https://blockworks.co/category/markets
2024-06-10 00:59:08,Bitcoin ETF segment sees record-tying fifth straight day of outflows,https://blockworks.co/category/markets
2024-06-10 00:59:08,How the Bitcoin halving could impact ailing mining stocks,https://blockworks.co/category/markets
2024-06-10 00:59:08,Bitcoin dips below $60K as pre-halving volatility reigns,https://blockworks.co/category/markets
2024-06-10 00:59:08,Cryptos slip as Powell doubles-down on delaying rate cuts,https://blockworks.co/category/markets
2024-06-10 00:59:08,Solana price falls further as Ore suspends mining on the network,https://blockworks.co/category/markets
2024-06-10 00:59:08,Spot bitcoin ETF flows turn positive again as GBTC outflows taper,https://blockworks.co/category/markets
2024-06-10 00:59:08,Cryptocurrencies slip while stocks bounce on red-hot jobs data,https://blockworks.co/category/markets
2024-06-10 00:59:08,"Cryptocurrencies, stocks bounce as Powell calms traders",https://blockworks.co/category/markets
2024-06-10 00:59:08,"Bitcoin, ether kick off Q2 in the red as halving approaches",https://blockworks.co/category/markets
2024-06-10 00:59:08,Solana breaks $200 as memecoin and airdrop interest continue,https://blockworks.co/category/markets
2024-06-10 00:59:08,"Bitcoin back above $70K, crypto stocks follow suit",https://blockworks.co/category/markets
2024-06-10 00:59:08,Big Friday Crypto Selloff Pulls Bitcoin Below $70K,https://www.coindesk.com/
2024-06-10 00:59:08,Bitcoin’s Latest Rally to $71K Is Different From the March Breakout. Here's Why.,https://www.coindesk.com/
2024-06-10 00:59:08,Arculus: Moving Toward a Passwordless Future w/ Dr. Adam Lowe,https://www.coindesk.com/
2024-06-10 00:59:08,Arculus: Moving Toward a Passwordless Future w/ Dr. Adam Lowe,https://www.coindesk.com/
2024-06-10 00:59:08,"New York AG Pushes Back Against DCG, Silbert’s Motion to Dismiss Fraud Case",https://www.coindesk.com/
2024-06-10 00:59:08,Rune Christensen Explains Why He Wants to Remake Maker and Kill DAI,https://www.coindesk.com/
2024-06-10 00:59:08,Customers Bank Said to Debank Some Digital Asset Hedge Funds,https://www.coindesk.com/
2024-06-10 00:59:08,GameStop Tumbles 40% as Trading Icon Roaring Kitty Returns to Livestream,https://www.coindesk.com/
2024-06-10 00:59:08,Robinhood’s Bitstamp Deal Is Strategic and Brings Added Institutional Exposure: Bernstein,https://www.coindesk.com/
2024-06-10 00:59:08,"XRP Reached Multi-Month Low, Solana (SOL) on Strongest Support, Bitcoin (BTC) Price Drop Is Better Than You Think",https://u.today/
2024-06-10 00:59:08,"Cardano on Verge of ""Most Significant"" Milestone in Its History",https://u.today/
2024-06-10 00:59:08,Cardano: 3.47 Billion ADA Backs Up as Price Touches Weekly Support,https://u.today/
2024-06-10 00:59:08,Binance Breaks Major Milestone of 200 Million Users,https://u.today/
2024-06-10 00:59:08,231 Billion PEPE Withdrawal Stuns Major US Exchange: Bullish?,https://u.today/
2024-06-10 00:59:08,MicroStrategy's Michael Saylor Makes Bitcoin 'Satoshi' Statement: Details,https://u.today/
2024-06-10 00:59:08,XRP Price Prediction for June 9,https://u.today/
2024-06-10 00:59:08,Polkadot (DOT) Price: Rebound Soon?,https://u.today/
2024-06-10 00:59:08,SHIB Price Prediction for June 9,https://u.today/
2024-06-10 00:59:08,Top Ethereum Contributor Makes Epic U-Turn With Unexpected Gas Fee Statement,https://u.today/
2024-06-10 00:59:08,Charles Hoskinson Reveals Mind-Blowing Fact About Elon Musk,https://u.today/
2024-06-10 00:59:08,Key Reason Why Bitcoin Price Has Not Topped $70K Named by Top Trader,https://u.today/
2024-06-10 00:59:08,Ethereum (ETH) Loses Critical Support Level,https://u.today/
2024-06-10 00:59:08,XRP's Price Performance Is Not as Bad as It Looks: Analyst,https://u.today/
2024-06-10 00:59:08,Shiba Inu Issues Major Wallet Alert for All SHIB Holders,https://u.today/
2024-06-10 00:59:08,17 Trillion Shiba Inu (SHIB) in 7 Days: What's Happening?,https://u.today/
2024-06-10 00:59:08,Iggy Azalea Escalates Feud with Vitalik Buterin,https://u.today/
2024-06-10 00:59:08,Former Ripple Director Urges Company to Make New Acquisition,https://u.today/
2024-06-10 00:59:08,"Ancient ETH Whale Wakes Up, Moves Money to Kraken",https://u.today/
2024-06-10 00:59:08,Biggest Ethereum (ETH) Hard Fork Coming: Pectra Agenda Announced,https://u.today/
2024-06-10 00:59:08,"XRP Reached Multi-Month Low, Solana (SOL) on Strongest Support, Bitcoin (BTC) Price Drop Is Better Than You Think",https://u.today/
2024-06-10 00:59:08,"Cardano on Verge of ""Most Significant"" Milestone in Its History",https://u.today/
2024-06-10 00:59:08,Cardano: 3.47 Billion ADA Backs Up as Price Touches Weekly Support,https://u.today/
2024-06-10 00:59:08,Binance Breaks Major Milestone of 200 Million Users,https://u.today/
2024-06-10 00:59:08,231 Billion PEPE Withdrawal Stuns Major US Exchange: Bullish?,https://u.today/
2024-06-10 00:59:08,Polkadot (DOT) Price: Rebound Soon?,https://u.today/
2024-06-10 00:59:08,Key Reasons Why Polygon (MATIC) Price Might Skyrocket,https://u.today/
2024-06-10 00:59:08,"UXLINK Telegram-Based App Completes NFT Distribution, Teases Token Airdrop",https://u.today/
2024-06-10 00:59:08,"$1.5 Billion in AUM, Major Trends for 2024-2025 and Market-Making Across Three Bull Runs: Interview With CLS Global CEO Filipp Veselov",https://u.today/
2024-06-10 00:59:08,PrimeXBT Streamlines Crypto Futures Trading for Newbies and Pros: Review,https://u.today/
2024-06-10 00:59:08,"Supermoon, OORT, Ammocrypt, & Sunrise Hosted 1,000+ Founders, Builders, Investors during Consensus 2024",https://u.today/
2024-06-10 00:59:08,BEVM Visionary Builders (BVB) Program Launches a 60 Million Ecosystem Incentives Program,https://u.today/
2024-06-10 00:59:08,B2BinPay v20 – Boosted Capabilities with TRX Staking and Expanded Blockchain Support,https://u.today/
2024-06-10 00:59:08,BetFury Announces $20 Million Cryptodrop Event,https://u.today/
2024-06-10 00:59:08,"LIX Expands Partnership with ComAve to the French Football League, Featuring Lyon Football Club",https://u.today/
2024-06-10 00:59:08,Warden Protocol Unveils Genesis Campaign Dashboard to Boost Community Engagement,https://u.today/
2024-06-10 00:59:08,HashKey Global's Trading Volume Surpasses Coinbase International,https://u.today/
2024-06-10 00:59:08,‘Moonrise’ Initiative Signals Next Phase in Evolution for New-Look Moonbeam Network in Polkadot Ecosytem,https://u.today/
2024-06-10 00:59:08,New Solana Meme Coin Sealana Surges Past $2.5M in ICO – The Next Big Crypto to Explode?,https://u.today/
2024-06-10 00:59:08,Sealana: Can the Chubby Seal Move From Mom’s Basement to Top Meme Coin Rankings?,https://u.today/
2024-06-10 00:59:08,Viral Dogeverse Presale Nears $13M – Chain-Hopping Cosmo Brings Multibridge Utilities,https://u.today/
2024-06-10 00:59:08,WienerAI: The Viral New Meme Coin Reignites AI Crypto Frenzy With Sausage Army,https://u.today/
2024-06-10 00:59:08,Multichain Meme Coin Dogeverse Hits $10M in Presale – Is it Too Late to Buy?,https://u.today/
2024-06-10 00:59:08,Traders Remain Bullish on Bitcoin Despite BTC Breaking Triangle Pattern; Are These Meme Coins a Good Buy On the Pullback?,https://u.today/
2024-06-10 00:59:08,"New Memecoin GODLEN Emerges, As BOME & DogWifHat Are Chasing New Gains",https://u.today/
2024-06-10 00:59:08,Stakingfarm Introduces New Passive Income Tools,https://u.today/
2024-06-10 00:59:08,"UXLINK Telegram-Based App Completes NFT Distribution, Teases Token Airdrop",https://u.today/
2024-06-10 00:59:08,Margex Offers All-In-One Crypto Trading and Earning Experience for Newbies and Pros: Review,https://u.today/
2024-06-10 00:59:08,PrimeXBT Streamlines Crypto Futures Trading for Newbies and Pros: Review,https://u.today/
2024-06-10 00:59:08,"dWallet Network Comes to Aptos (APT) for Multi-Chain DeFi, GameFi Protocols",https://u.today/
2024-06-10 00:59:08,Haruko to Streamline Bitcoin Asset Management With Stacks Integration,https://u.today/
2024-06-10 00:59:08,"Bitget Joins Ethena Labs Сraze, Integrates USDe as Margin Option for Coin-Margined Contracts",https://u.today/
2024-06-10 00:59:08,"XRP Reached Multi-Month Low, Solana (SOL) on Strongest Support, Bitcoin (BTC) Price Drop Is Better Than You Think",https://u.today/
2024-06-10 00:59:08,"Is Ethereum (ETH) Going to Lose $4,000? Solana at $170: Was It Fakeout? XRP Remains Stable",https://u.today/
2024-06-10 00:59:08,Bitcoin (BTC) Hidden Disaster Incoming? XRP Reaches Turning Point: What's Next? Shiba Inu (SHIB) on Path to Victory?,https://u.today/
2024-06-10 00:59:08,"XRP Reached Multi-Month Low, Solana (SOL) on Strongest Support, Bitcoin (BTC) Price Drop Is Better Than You Think",https://u.today/
2024-06-10 00:59:08,"Is Ethereum (ETH) Going to Lose $4,000? Solana at $170: Was It Fakeout? XRP Remains Stable",https://u.today/
2024-06-10 00:59:08,Bitcoin (BTC) Hidden Disaster Incoming? XRP Reaches Turning Point: What's Next? Shiba Inu (SHIB) on Path to Victory?,https://u.today/
2024-06-10 00:59:08,XRP Price Prediction for June 9,https://u.today/
2024-06-10 00:59:08,SHIB Price Prediction for June 9,https://u.today/
2024-06-10 00:59:08,Bitcoin (BTC) Price Prediction for June 8,https://u.today/
2024-06-10 00:59:08,DOGE Price Prediction for June 8,https://u.today/
2024-06-10 00:59:08,SHIB Price Prediction for June 7,https://u.today/
2024-06-10 00:59:08,Cardano (ADA) Price Prediction for June 7,https://u.today/
2024-06-10 00:59:08,"XRP Reached Multi-Month Low, Solana (SOL) on Strongest Support, Bitcoin (BTC) Price Drop Is Better Than You Think",https://u.today/
2024-06-10 00:59:08,"Cardano on Verge of ""Most Significant"" Milestone in Its History",https://u.today/
2024-06-10 00:59:08,Cardano: 3.47 Billion ADA Backs Up as Price Touches Weekly Support,https://u.today/
2024-06-10 00:59:08,Binance Breaks Major Milestone of 200 Million Users,https://u.today/
2024-06-10 00:59:08,231 Billion PEPE Withdrawal Stuns Major US Exchange: Bullish?,https://u.today/
2024-06-10 00:59:08,MicroStrategy's Michael Saylor Makes Bitcoin 'Satoshi' Statement: Details,https://u.today/
2024-06-10 00:59:08,Top Ethereum Contributor Makes Epic U-Turn With Unexpected Gas Fee Statement,https://u.today/
2024-06-10 00:59:08,Charles Hoskinson Reveals Mind-Blowing Fact About Elon Musk,https://u.today/
2024-06-10 00:59:08,Key Reason Why Bitcoin Price Has Not Topped $70K Named by Top Trader,https://u.today/
2024-06-10 00:59:08,Ethereum (ETH) Loses Critical Support Level,https://u.today/
2024-06-10 00:59:08,XRP's Price Performance Is Not as Bad as It Looks: Analyst,https://u.today/
2024-06-10 00:59:08,Shiba Inu Issues Major Wallet Alert for All SHIB Holders,https://u.today/
2024-06-10 00:59:08,17 Trillion Shiba Inu (SHIB) in 7 Days: What's Happening?,https://u.today/
2024-06-10 00:59:08,Iggy Azalea Escalates Feud with Vitalik Buterin,https://u.today/
2024-06-10 00:59:08,Former Ripple Director Urges Company to Make New Acquisition,https://u.today/
2024-06-10 00:59:08,"Ancient ETH Whale Wakes Up, Moves Money to Kraken",https://u.today/
2024-06-10 00:59:08,Biggest Ethereum (ETH) Hard Fork Coming: Pectra Agenda Announced,https://u.today/
2024-06-10 00:59:08,Dogecoin Gets New Trading Pair on Major US Crypto Exchange: Details,https://u.today/
2024-06-10 00:59:08,Shiba Inu Skyrockets 110% in Volumes as $410 Million Sell-Off Hits Market,https://u.today/
2024-06-10 00:59:08,"XRP Ledger Ready to Adopt Tokenized Gold, Silver in Q3, 2024",https://u.today/
2024-06-10 00:59:08,Shiba Inu Nears Critical 40 Trillion SHIB Support Level as Prices Fall,https://u.today/
2024-06-10 00:59:08,SHIB Rival WIF Worst Performer in Top 100 as Crypto Dips,https://u.today/
2024-06-10 00:59:08,"DOGE, PEPE and WIF See Millions in Token Liquidations, Here's What Happened",https://u.today/
2024-06-10 00:59:08,XRP Surges 103% in Volume as Market Faces $410 Million Sell-Off,https://u.today/
2024-06-10 00:59:08,"1,901 Bitcoin (BTC) Added to ETFs in Single Day, Why No Price Jump?",https://u.today/
2024-06-10 00:59:08,Satoshi Mystery: Ripple CTO Makes Unexpected Remark,https://u.today/
2024-06-10 00:59:08,"27.78 Billion Dogecoin (DOGE) in 24 Hours Stacked by Whales, What's Happening?",https://u.today/
2024-06-10 00:59:08,"XRP, DOGE Armies Excited by Elon Musk's Message on X",https://u.today/
2024-06-10 00:59:08,SHIB Team Makes Major Einstein Warning: Details,https://u.today/
2024-06-10 00:59:08,Double Bullish Bitcoin Godzilla Candles Case Suggested by Samson Mow,https://u.today/
2024-06-10 00:59:08,Arbitrum DAO Approves $222 Million for Gaming Ecosystem Expansion,https://beincrypto.com/
2024-06-10 00:59:08,Base Meme Coin BRETT Hits New All-Time High and $1.9 Billion Market Cap Milestone,https://beincrypto.com/
2024-06-10 00:59:08,Charles Hoskinson Criticizes Media’s Unfair Coverage of Cardano,https://beincrypto.com/
2024-06-10 00:59:08,PEPE Attracts $8 Million from Crypto Whales Amid Price Corrections,https://beincrypto.com/
2024-06-10 00:59:08,5 Token Unlocks to Watch Next Week,https://beincrypto.com/
2024-06-10 00:59:08,Hedge Funds Bet Against Bitcoin with Record Short Positions on CME Futures,https://beincrypto.com/
2024-06-10 00:59:08,Recent Crypto Crackdown in Nigerian Calls for Regulation,https://www.cryptotimes.io/category/market-news/
2024-06-10 00:59:08,Alipay Unveils Controversial AI Feature that Detects Hair Loss,https://www.cryptotimes.io/category/market-news/
2024-06-10 00:59:08,OKX Wallet Partners with Copra for New Crypto Earning Option,https://www.cryptotimes.io/category/market-news/
2024-06-10 00:59:08,"AfDB, Intel to Teach AI Training to Millions in Africa",https://www.cryptotimes.io/category/market-news/
2024-06-10 00:59:08,Arbitrum launches $215m program to drive gaming innovation,https://www.cryptotimes.io/category/market-news/
2024-06-10 00:59:08,Wintermut CEO Challenges Ethereum Leader on Capitalism vs Socialism,https://www.cryptotimes.io/category/market-news/
2024-06-10 00:59:08,Rapper Iggy Azalea Accused Buterin of Pocketing Gas Fee,https://www.cryptotimes.io/category/market-news/
2024-06-10 00:59:08,Crypto Influencer Suffers $8m Loss on Meme Coin FRIEND,https://www.cryptotimes.io/category/market-news/
2024-06-10 00:59:08,Binance Hits 200 Million Users Amid Crypto Adoption Surge,https://www.cryptotimes.io/category/market-news/
2024-06-10 00:59:08,BingX Announces Improvement in Coin-margined Features Trading,https://www.cryptotimes.io/category/market-news/
2024-06-10 00:59:08,Ancient $21.9m Ethereum Whale Awakens After 9 Years,https://www.cryptotimes.io/category/market-news/
2024-06-10 00:59:08,Traders View Crypto Market Downturn as Short-Term “Shakeout”,https://www.cryptotimes.io/category/market-news/
2024-06-10 00:59:08,Potential Juror Misconduct in Trump Trial Raises Concerns,https://www.cryptotimes.io/category/market-news/
2024-06-10 00:59:08,Crypto Data Platform CoinGecko Gets Hit By Data Breach,https://www.cryptotimes.io/category/market-news/
2024-06-10 00:59:08,Bakkt Holdings Considers Breakup Amid Financial Challenges,https://www.cryptotimes.io/category/market-news/
2024-06-10 00:59:08,HKMA Alerts Public of Unregulated ‘Kucoin’ Crypto Scam,https://www.cryptotimes.io/category/market-news/
2024-06-10 00:59:08,OKX’s Program Testing Spike Bitcoin Network Fees,https://www.cryptotimes.io/category/market-news/
2024-06-10 00:59:08,DeFi TVL Reaches $192B in May Amid Decline in Active Wallets,https://www.cryptotimes.io/category/market-news/
2024-06-10 00:59:08,Trump Calls Himself as ‘Crypto President’ at San Francisco Fundraiser,https://www.cryptotimes.io/category/market-news/
2024-06-10 00:59:08,Base Beats OP Mainnet to Become Largest L2 Superchain,https://www.cryptotimes.io/category/market-news/
2024-06-10 00:59:08,Bitget Launches Exclusive Offer For New European Users,https://www.cryptotimes.io/category/market-news/
2024-06-10 00:59:08,Norwegian Government Recovers $5.7M in Ronin Bridge Cyber Attack,https://www.cryptotimes.io/category/market-news/
2024-06-10 00:59:08,Alchemy Pay Integrates USDt on TON for Seamless Transaction,https://www.cryptotimes.io/category/market-news/
2024-06-10 00:59:08,Breaking News: Nasdaq Halts Trading for GameStop Stocks,https://www.cryptotimes.io/category/market-news/
2024-06-10 00:59:08,Bitdeer’s Chief Business Officer Unveils SEALMINER R&D Plan,https://www.cryptotimes.io/category/market-news/
2024-06-10 00:59:08,Former Officials Unite to Free Binance Exec in Nigeria,https://www.cryptotimes.io/category/market-news/
2024-06-10 00:59:08,Elon Musk’s Deepfake Scam Floods YouTube During SpaceX Launch,https://www.cryptotimes.io/category/market-news/
2024-06-10 00:59:08,MicroStrategy Faces $6.9B Bet Against Stock from Big Shorts,https://www.cryptotimes.io/category/market-news/
2024-06-10 00:59:08,Ripple Executive Rips Apart SEC Over Waste of Taxpayers’ Dollars,https://www.cryptotimes.io/category/market-news/
2024-06-10 00:59:08,Bitdeer Acquires FreeChain in 20M Share Deal to Boost ASIC,https://www.cryptotimes.io/category/market-news/
2024-06-11 00:57:40,Crypto Firm DeFi Technologies Adopts Bitcoin As Its Primary Treasury Reserve Asset,https://decrypt.co/
2024-06-11 00:57:40,Normie Meme Coin Team Apologizes for Posting a Video Depicting Suicide to Promote Its Token,https://decrypt.co/
2024-06-11 00:57:40,Ariana Grande's Michi Meme Post Boosts the Solana Meme Coin 18%,https://decrypt.co/
2024-06-11 00:57:40,ZKSync Introduces ZK Nation to Decentralize Its Protocol Amid Airdrop Plans,https://decrypt.co/
2024-06-11 00:57:40,Uniswap Labs Has Acquired Viral Reality Competition ‘Crypto: The Game’,https://decrypt.co/
2024-06-11 00:57:40,"Bitcoin ETFs Attracted $2 Billion in Deposits Even As BTC Price Dropped Below $69,000",https://decrypt.co/
2024-06-11 00:57:40,Donald Trump Says He Will Be a ‘Crypto President’: Report,https://decrypt.co/
2024-06-11 00:57:40,Friend.tech Plan to Leave Base to Launch Its Own Network Batters Token,https://decrypt.co/
2024-06-11 00:57:40,"AI Technology Is Being Used in Crypto Crime, But Not Very Widely: Elliptic",https://decrypt.co/
2024-06-11 00:57:40,US Charges UK Nationals in 'Evolved Ape' NFT Rug Pull Scam,https://decrypt.co/
2024-06-11 00:57:40,"Donald Trump Told $12 Million Donor He'd Be the ""Crypto President"": Reuters",https://decrypt.co/
2024-06-11 00:57:40,"$237 Million Arbitrum Gaming Proposal Passes, But Some Demand a Revote",https://decrypt.co/
2024-06-11 00:57:40,"A Large Exchange Is Tidying Up Its Wallet, Sending Bitcoin Fees Surging",https://decrypt.co/
2024-06-11 00:57:40,Bybit Opens Its Doors to Chinese Citizens Living Outside of Mainland China,https://decrypt.co/
2024-06-11 00:57:40,"Bitcoin and Ethereum Prices Plummet, Triggering Nearly $300 Million in Liquidations",https://decrypt.co/
2024-06-11 00:57:40,Base memecoin Based Brett threatens to flip Solana’s BONK,https://blockworks.co/category/markets
2024-06-11 00:57:40,"Hotter-than-expected jobs report shows mixed bag, markets dip",https://blockworks.co/category/markets
2024-06-11 00:57:40,Mt Gox distributions may not be all doom and gloom for bitcoin,https://blockworks.co/category/markets
2024-06-11 00:57:40,"Ether, bitcoin rally on renewed ETH ETF optimism",https://blockworks.co/category/markets
