date_scraped,headline,source
2024-05-30 00:55:46,Shiba Inu (SHIB) Surpasses Cardano (ADA) by Market Cap,https://u.today/
2024-05-30 00:55:46,"GameFi Is Coming Back, Says Illuvium Co-Founder",https://beincrypto.com/
2024-05-30 00:55:46,What’s Stopping Toncoin (TON) from Reaching a New All-Time High,https://beincrypto.com/
2024-05-30 00:55:46,PayPal Expands PYUSD to Solana Blockchain,https://beincrypto.com/
2024-05-30 00:55:46,Gold or Bitcoin: What is the Future of Mining?,https://beincrypto.com/
2024-05-30 00:55:46,ZKasino Users Urged to Reclaim Ethereum Amid Fraud Investigation,https://beincrypto.com/
2024-05-30 00:55:46,This Is How Fetch.ai (FET) Price Could Fall Below $2,https://beincrypto.com/
2024-05-30 00:55:46,CME Abandons Solana Futures Plans Amid Network Criticism,https://www.cryptotimes.io/category/market-news/
2024-05-30 00:55:46,Stablecoin Market Capitalization Reaches $161B in May 2024,https://www.cryptotimes.io/category/market-news/
2024-05-30 00:55:46,OKX Marketplace Supports  zkEVM for Blockchain Gaming,https://www.cryptotimes.io/category/market-news/
2024-05-30 00:55:46,Disbarred Attorney Plead Guilty in $9.5M Crypto Ponzi Scheme,https://www.cryptotimes.io/category/market-news/
2024-05-30 00:55:46,SEC Issues Urgent Crypto Scam Warning Amid AI Exploitation,https://www.cryptotimes.io/category/market-news/
2024-05-30 00:55:46,Iggy Azalea’s MOTHER Coin Faces Insider Trading Scandal,https://www.cryptotimes.io/category/market-news/
2024-05-30 00:55:46,Former ConsenSys Employee Launches New Stablecoin USD3,https://www.cryptotimes.io/category/market-news/
2024-05-30 00:55:46,Nasdaq Withdraws Hashdex Ethereum ETF Proposal Amid SEC Hurdles,https://www.cryptotimes.io/category/market-news/
2024-05-30 00:55:46,Bitfarms Rejects Takeover Proposal from Riot Platforms,https://www.cryptotimes.io/category/market-news/
2024-05-30 00:55:46,Gemini’s $2 Billion Crypto Return to Earn Members,https://www.cryptotimes.io/category/market-news/
2024-05-30 00:55:46,Israel’s Central Bank Initiates Digital Shekel Payment Challenge,https://www.cryptotimes.io/category/market-news/
2024-05-30 00:55:46,Mastercard Introduces Crypto Credential Pilot,https://www.cryptotimes.io/category/market-news/
2024-05-30 00:55:46,PayPal USD Stablecoin Goes Live on Solana Blockchain,https://www.cryptotimes.io/category/market-news/
2024-05-30 00:55:46,Helen Toner Unveils OpenAI Controversy on TED AI Show,https://www.cryptotimes.io/category/market-news/
2024-05-30 00:55:46,Texas Halts Alleged Crypto Mining MLM Scheme Promoted on Social Media,https://www.cryptotimes.io/category/market-news/
2024-05-30 00:55:46,Hong Kong SFC Tightens Rules for VATPs,https://www.cryptotimes.io/category/market-news/
2024-05-30 00:55:46,London’s Kroo Bank Halts Crypto Transactions from May 30,https://www.cryptotimes.io/category/market-news/
2024-05-30 00:55:46,Judge Orders the U.S. SEC to Pay $1.8M in Debt Box Case,https://www.cryptotimes.io/category/market-news/
2024-05-30 00:55:46,ZKasino Starts 72-Hour Refund Process Post $33M Allegations,https://www.cryptotimes.io/category/market-news/
2024-05-30 00:55:46,BlackRock Purchases iShares Bitcoin Trust Shares in Q1 2024,https://www.cryptotimes.io/category/market-news/
2024-05-30 00:55:46,XRP Lawyer Calls for Gensler Resignation Amid SEC Dispute,https://www.cryptotimes.io/category/market-news/
2024-05-30 00:55:46,Cybersecurity Expert Warns of Escalating Ransomware Tactics,https://www.cryptotimes.io/category/market-news/
2024-05-30 00:55:46,Binance France Restructures Ownership Amid Regulatory Shifts,https://www.cryptotimes.io/category/market-news/
2024-05-30 00:55:46,Ex-FTX Executive Ryan Salame Sentenced 7.5 Years in Jail,https://www.cryptotimes.io/category/market-news/
2024-05-30 00:55:46,Metaplanet Further Embraces Bitcoin with ¥250 Million Purchase,https://www.cryptotimes.io/category/market-news/
2024-05-30 00:55:46,Ledger Stax Finally Ships Hardware Wallets After 18 Months,https://www.cryptotimes.io/category/market-news/
2024-05-30 00:55:46,The Sandbox Launches DAO To Enable Community Governance,https://www.cryptotimes.io/category/market-news/
2024-05-30 00:55:46,Trump’s Crypto Support Boosts His Odds in Prediction Markets,https://www.cryptotimes.io/category/market-news/
2024-05-30 00:55:46,Nigerian Senate Calls for Regulation of Crypto Trading,https://www.cryptotimes.io/category/market-news/
2024-05-30 00:55:46,Chainlink Partners with Swift at Consensys Conference,https://www.cryptotimes.io/category/market-news/
2024-05-31 00:56:44,"Square Enix Adopts Arbitrum for Symbiogenesis NFT Game, Slashing Gas Fees",https://decrypt.co/
2024-05-31 00:56:44,"BlackRock's Amended S-1 Form Reveals a ""Seed Capital Investor"" Has Purchased Shares for Its Proposed Ether ETF, Potentially Launching by the End of June",https://decrypt.co/
2024-05-31 00:56:44,BlackRock's Updates Spot Ethereum ETF Application With the SEC,https://decrypt.co/
2024-05-31 00:56:44,Sahil Arora Pockets $380K From Fake Iggy Azalea Meme Coin,https://decrypt.co/
2024-05-31 00:56:44,"Mastercard Launches ""Crypto Credential"" to Simplify Peer-to-Peer Crypto Payments",https://decrypt.co/
2024-05-31 00:56:44,44% of US Voters Want Clear Regulations Before Buying Crypto: Survey,https://decrypt.co/
2024-05-31 00:56:44,Ripple Donates $25 Million to Pro-Crypto PAC Fairshake to Bolster Crypto Education and Advocacy,https://decrypt.co/
2024-05-31 00:56:44,‘Crypto Unicorns’ Airdrop Details Revealed As It Migrates to Arbitrum's Xai Gaming Network,https://decrypt.co/
2024-05-31 00:56:44,"Tapos Cat Tickling Game Goes Viral, Brings Aptos 200 Million Transactions In First Two Days",https://decrypt.co/
2024-05-31 00:56:44,"At First Samourai Wallet Hearing, Prosecution Says It's Waiting for Dev to Turn Over 2 Terabyte Hard Drive",https://decrypt.co/
2024-05-31 00:56:44,"PEPE Daily Active Addresses Have More Than Doubled, Outpacing Other Meme Coins",https://decrypt.co/
2024-05-31 00:56:44,Semler Scientific Adopts MicroStrategy Bitcoin Playbook—Its Stock Surged 33%,https://decrypt.co/
2024-05-31 00:56:44,Sandbox Launches DAO to Let Token Holders Shape the Game's Future,https://decrypt.co/
2024-05-31 00:56:44,Ryan Salame Gets 7.5 Year Prison Sentence—But Can Keep His Porsche,https://decrypt.co/
2024-05-31 00:56:44,Binance France Replaces Changpeng Zhao With Two Shareholders to Comply With EU Regulations,https://decrypt.co/
2024-05-31 00:56:44,Mt Gox distributions may not be all doom and gloom for bitcoin,https://blockworks.co/category/markets
2024-05-31 00:56:44,"Ether, bitcoin rally on renewed ETH ETF optimism",https://blockworks.co/category/markets
2024-05-31 00:56:44,Is the SEC’s expected spot ether ETF denial priced in?,https://blockworks.co/category/markets
2024-05-31 00:56:44,"Cryptocurrencies rally, stocks trade sideways as traders speculate interest rate decision",https://blockworks.co/category/markets
2024-05-31 00:56:44,"Bitcoin is back above $60K, stocks rally on cooler jobs data",https://blockworks.co/category/markets
2024-05-31 00:56:44,"Fed holds interest rates, markets hardly react",https://blockworks.co/category/markets
2024-05-31 00:56:44,"Cryptocurrencies, stocks slide ahead of Fed rate decision",https://blockworks.co/category/markets
2024-05-31 00:56:44,"Stocks bounce, cryptocurrencies trade sideways despite disappointing inflation data",https://blockworks.co/category/markets
2024-05-31 00:56:44,"Cryptocurrencies, equities slide on slowing economic growth",https://blockworks.co/category/markets
2024-05-31 00:56:44,"BlackRock’s bitcoin ETF inflows halt after 71-day streak, data shows",https://blockworks.co/category/markets
2024-05-31 00:56:44,"Bitcoin hovers around $63,600 following the halving",https://blockworks.co/category/markets
2024-05-31 00:56:44,Bitcoin’s block reward slashed by 50% following 2024 halving,https://blockworks.co/category/markets
2024-05-31 00:56:44,Bitcoin ETF segment sees record-tying fifth straight day of outflows,https://blockworks.co/category/markets
2024-05-31 00:56:44,How the Bitcoin halving could impact ailing mining stocks,https://blockworks.co/category/markets
2024-05-31 00:56:44,Bitcoin dips below $60K as pre-halving volatility reigns,https://blockworks.co/category/markets
2024-05-31 00:56:44,Cryptos slip as Powell doubles-down on delaying rate cuts,https://blockworks.co/category/markets
2024-05-31 00:56:44,Solana price falls further as Ore suspends mining on the network,https://blockworks.co/category/markets
2024-05-31 00:56:44,Spot bitcoin ETF flows turn positive again as GBTC outflows taper,https://blockworks.co/category/markets
2024-05-31 00:56:44,Cryptocurrencies slip while stocks bounce on red-hot jobs data,https://blockworks.co/category/markets
2024-05-31 00:56:44,"Cryptocurrencies, stocks bounce as Powell calms traders",https://blockworks.co/category/markets
2024-05-31 00:56:44,"Bitcoin, ether kick off Q2 in the red as halving approaches",https://blockworks.co/category/markets
2024-05-31 00:56:44,Solana breaks $200 as memecoin and airdrop interest continue,https://blockworks.co/category/markets
2024-05-31 00:56:44,"Bitcoin back above $70K, crypto stocks follow suit",https://blockworks.co/category/markets
2024-05-31 00:56:44,Bitcoin ETF snapshot: Net outflow run hits five days for the first time,https://blockworks.co/category/markets
2024-05-31 00:56:44,Robert F. Kennedy Jr. on Trump's Guilty Verdict and Pro-Crypto Stance,https://www.coindesk.com/
2024-05-31 00:56:44,TRUMP Token Sinks After Former U.S. President Is Found Guilty in New York,https://www.coindesk.com/
2024-05-31 00:56:44,How Radix is Gamifying DeFi Participation with Token Trek,https://www.coindesk.com/
2024-05-31 00:56:44,How Radix is Gamifying DeFi Participation with Token Trek,https://www.coindesk.com/
2024-05-31 00:56:44,RFK Jr. Says Guilty Verdict May Help Trump's Election Prospects,https://www.coindesk.com/
2024-05-31 00:56:44,"Ripple's Brad Garlinghouse Foresees XRP, Solana, Cardano ETFs: Consensus 2024",https://www.coindesk.com/
2024-05-31 00:56:44,Everyone at Consensus 2024 Is Talking About Biden’s Crypto Flip Flop. Is He for Real?,https://www.coindesk.com/
2024-05-31 00:56:44,"Franklin Templeton's Jenny Johnson on Bitcoin ETFs, RWA Tokenization and Blockchain's Potential for TradFi",https://www.coindesk.com/
2024-05-31 00:56:44,Sen. Warren Wants to Know How Drug Agencies Are Pursuing Crypto Ties to Fentanyl,https://www.coindesk.com/
2024-05-31 00:56:44,"Cardano (ADA) Is In Catastrophic State, Bitcoin (BTC) Future to Surprise You, Solana (SOL) Can Still Be Saved: Here's How",https://u.today/
2024-05-31 00:56:44,"Satoshi ""Almost Certainly"" Aware of DOG Meme Coin If They Are Alive, Ordinals Developer Says",https://u.today/
2024-05-31 00:56:44,"""Crypto Mom"" Proposes US-UK Regulatory Sandbox",https://u.today/
2024-05-31 00:56:44,Ether Spot ETF: Pessimistic Report by JPMorgan,https://u.today/
2024-05-31 00:56:44,"Ripple Donates $100K to Victims of Brazil Floods, PayPal's Stablecoin Goes Live on Solana, Mastercard Issues New Crypto Announcement: Crypto News Digest by U.Today",https://u.today/
2024-05-31 00:56:44,Toncoin (TON) Price Prediction for May 30,https://u.today/
2024-05-31 00:56:44,"PEPE Becomes Most Profitable Meme Coin, But What About Shiba Inu (SHIB)?",https://u.today/
2024-05-31 00:56:44,"Binance Expands Offerings With NEAR, NOT Pairs",https://u.today/
2024-05-31 00:56:44,DOGE Price Prediction for May 30,https://u.today/
2024-05-31 00:56:44,Turbo (TURBO) Meme Coin Price Adds 20% in One Hour: Reason,https://u.today/
2024-05-31 00:56:44,Solana (SOL) Dominates Ethereum (ETH): Glassnode Cofounder,https://u.today/
2024-05-31 00:56:44,Shiba Inu (SHIB) Hailed by Boxing Legend Manny Pacquiao,https://u.today/
2024-05-31 00:56:44,Ethereum Whale Holding $650 Million in ETH Decoded: Possible Identity Unveiled,https://u.today/
2024-05-31 00:56:44,Dogecoin (DOGE) Lead Dev Shares Crucial Warning,https://u.today/
2024-05-31 00:56:44,"Ramp Network Adds 35 National Currencies, Expands Presence in Europe",https://u.today/
2024-05-31 00:56:44,"Mt. Gox Could Benefit Ethereum Upon Spot ETF Launch, Insider Claims, Here's How",https://u.today/
2024-05-31 00:56:44,Cardano Founder Reveals Road Not Taken in Building Cardano,https://u.today/
2024-05-31 00:56:44,XRP Just Dropped Below Crucial Support Level,https://u.today/
2024-05-31 00:56:44,Stride Protocol Integrates With Namada for Asset Security: Details,https://u.today/
2024-05-31 00:56:44,Ripple CEO Calls for Clear US Crypto Regulation: Details,https://u.today/
2024-05-31 00:56:44,"Cardano (ADA) Is In Catastrophic State, Bitcoin (BTC) Future to Surprise You, Solana (SOL) Can Still Be Saved: Here's How",https://u.today/
2024-05-31 00:56:44,"Satoshi ""Almost Certainly"" Aware of DOG Meme Coin If They Are Alive, Ordinals Developer Says",https://u.today/
2024-05-31 00:56:44,"""Crypto Mom"" Proposes US-UK Regulatory Sandbox",https://u.today/
2024-05-31 00:56:44,Ether Spot ETF: Pessimistic Report by JPMorgan,https://u.today/
2024-05-31 00:56:44,"Ripple Donates $100K to Victims of Brazil Floods, PayPal's Stablecoin Goes Live on Solana, Mastercard Issues New Crypto Announcement: Crypto News Digest by U.Today",https://u.today/
2024-05-31 00:56:44,Ethereum and Bitcoin Correlation: Will Ether Price Pick Up Pace?,https://u.today/
2024-05-31 00:56:44,What Berkshire's Holdings Can Tell Us About Bitcoin's Future Price,https://u.today/
2024-05-31 00:56:44,Do Traditional Investors See Bitcoin as Risk Asset?,https://u.today/
2024-05-31 00:56:44,Bitcoin and S&P 500: Are Crypto and Stock Markets Still Unrelated?,https://u.today/
2024-05-31 00:56:44,"Challenges of Web3 Education, Solidity Engineers Training and First Free Guide on ZK Tech: Interview With RareSkills Founder Jeffrey Scholz",https://u.today/
2024-05-31 00:56:44,Sui and Atoma Bring the Power of AI to dApp Builders,https://u.today/
2024-05-31 00:56:44,Bitsgap Adds ByBit Futures to Its Trading Terminal,https://u.today/
2024-05-31 00:56:44,The Great Equalizer: KHABY Simplifies Crypto,https://u.today/
2024-05-31 00:56:44,Galxe Introduces Gravity: A Layer 1 Blockchain Designed for Omnichain Experience and Full-Chain Abstraction,https://u.today/
2024-05-31 00:56:44,Native Stablecoins Swell on Sui as Agora Adds AUSD Stablecoin to Network,https://u.today/
2024-05-31 00:56:44,Rivalz Network Launches Its Intel Incentivized Testnet,https://u.today/
2024-05-31 00:56:44,Introducing GigaPips by Avenix Fzco: The Cutting-Edge Forex Robot for Modern Traders,https://u.today/
2024-05-31 00:56:44,Limitless Opportunities Await at iFX EXPO International 2024,https://u.today/
2024-05-31 00:56:44,New Solana Meme Coin Sealana Surges Past $2.5M in ICO – The Next Big Crypto to Explode?,https://u.today/
2024-05-31 00:56:44,Sealana: Can the Chubby Seal Move From Mom’s Basement to Top Meme Coin Rankings?,https://u.today/
2024-05-31 00:56:44,Viral Dogeverse Presale Nears $13M – Chain-Hopping Cosmo Brings Multibridge Utilities,https://u.today/
2024-05-31 00:56:44,WienerAI: The Viral New Meme Coin Reignites AI Crypto Frenzy With Sausage Army,https://u.today/
2024-05-31 00:56:44,Multichain Meme Coin Dogeverse Hits $10M in Presale – Is it Too Late to Buy?,https://u.today/
2024-05-31 00:56:44,Traders Remain Bullish on Bitcoin Despite BTC Breaking Triangle Pattern; Are These Meme Coins a Good Buy On the Pullback?,https://u.today/
2024-05-31 00:56:44,"New Memecoin GODLEN Emerges, As BOME & DogWifHat Are Chasing New Gains",https://u.today/
2024-05-31 00:56:44,Stakingfarm Introduces New Passive Income Tools,https://u.today/
2024-05-31 00:56:44,Phoenix Introduces Yield Platform with USDC Payouts: Review,https://u.today/
2024-05-31 00:56:44,Yield App Offers Easy-to-Use Crypto Wealth Platform: Review,https://u.today/
2024-05-31 00:56:44,New-Gen Crypto Mining Ecosystem in 2024: Case of ViaBTC,https://u.today/
2024-05-31 00:56:44,"Ramp Network Adds 35 National Currencies, Expands Presence in Europe",https://u.today/
2024-05-31 00:56:44,Stride Protocol Integrates With Namada for Asset Security: Details,https://u.today/
2024-05-31 00:56:44,Novel Solana Meme Crypto PENGU Introduces Guiana NFTs,https://u.today/
2024-05-31 00:56:44,"Cardano (ADA) Is In Catastrophic State, Bitcoin (BTC) Future to Surprise You, Solana (SOL) Can Still Be Saved: Here's How",https://u.today/
2024-05-31 00:56:44,"Shiba Inu (SHIB) Surprises Everyone, Ethereum (ETH) Stumbles, When Will XRP Finally Do It?",https://u.today/
2024-05-31 00:56:44,"Cardano (ADA) in Dire State, Shiba Inu (SHIB) Needs Some Help, Ethereum (ETH) Dominance Continues",https://u.today/
2024-05-31 00:56:44,"Cardano (ADA) Is In Catastrophic State, Bitcoin (BTC) Future to Surprise You, Solana (SOL) Can Still Be Saved: Here's How",https://u.today/
2024-05-31 00:56:44,"Shiba Inu (SHIB) Surprises Everyone, Ethereum (ETH) Stumbles, When Will XRP Finally Do It?",https://u.today/
2024-05-31 00:56:44,"Cardano (ADA) in Dire State, Shiba Inu (SHIB) Needs Some Help, Ethereum (ETH) Dominance Continues",https://u.today/
2024-05-31 00:56:44,Toncoin (TON) Price Prediction for May 30,https://u.today/
2024-05-31 00:56:44,DOGE Price Prediction for May 30,https://u.today/
2024-05-31 00:56:44,Bitcoin (BTC) Price Prediction for May 29,https://u.today/
2024-05-31 00:56:44,XRP Price Prediction for May 29,https://u.today/
2024-05-31 00:56:44,SHIB Price Prediction for May 28,https://u.today/
2024-05-31 00:56:44,DOGE Price Prediction for May 28,https://u.today/
2024-05-31 00:56:44,"Cardano (ADA) Is In Catastrophic State, Bitcoin (BTC) Future to Surprise You, Solana (SOL) Can Still Be Saved: Here's How",https://u.today/
2024-05-31 00:56:44,"Satoshi ""Almost Certainly"" Aware of DOG Meme Coin If They Are Alive, Ordinals Developer Says",https://u.today/
2024-05-31 00:56:44,"""Crypto Mom"" Proposes US-UK Regulatory Sandbox",https://u.today/
2024-05-31 00:56:44,Ether Spot ETF: Pessimistic Report by JPMorgan,https://u.today/
2024-05-31 00:56:44,"Ripple Donates $100K to Victims of Brazil Floods, PayPal's Stablecoin Goes Live on Solana, Mastercard Issues New Crypto Announcement: Crypto News Digest by U.Today",https://u.today/
2024-05-31 00:56:44,"PEPE Becomes Most Profitable Meme Coin, But What About Shiba Inu (SHIB)?",https://u.today/
2024-05-31 00:56:44,"Binance Expands Offerings With NEAR, NOT Pairs",https://u.today/
2024-05-31 00:56:44,Turbo (TURBO) Meme Coin Price Adds 20% in One Hour: Reason,https://u.today/
2024-05-31 00:56:44,Solana (SOL) Dominates Ethereum (ETH): Glassnode Cofounder,https://u.today/
2024-05-31 00:56:44,Shiba Inu (SHIB) Hailed by Boxing Legend Manny Pacquiao,https://u.today/
2024-05-31 00:56:44,Ethereum Whale Holding $650 Million in ETH Decoded: Possible Identity Unveiled,https://u.today/
2024-05-31 00:56:44,Dogecoin (DOGE) Lead Dev Shares Crucial Warning,https://u.today/
2024-05-31 00:56:44,"Mt. Gox Could Benefit Ethereum Upon Spot ETF Launch, Insider Claims, Here's How",https://u.today/
2024-05-31 00:56:44,Cardano Founder Reveals Road Not Taken in Building Cardano,https://u.today/
2024-05-31 00:56:44,XRP Just Dropped Below Crucial Support Level,https://u.today/
2024-05-31 00:56:44,Ripple CEO Calls for Clear US Crypto Regulation: Details,https://u.today/
2024-05-31 00:56:44,Ethereum Whales Go Bullish as ETH Holdings Skyrocket,https://u.today/
2024-05-31 00:56:44,PEPE Plunges 20% From ATH as 660.7 Billion PEPE Go to Binance,https://u.today/
2024-05-31 00:56:44,"75 Billion Shiba Inu in 24 Hours, What's Happening?",https://u.today/
2024-05-31 00:56:44,8.65 Billion Dogecoin (DOGE) in 24 Hours: What's Up?,https://u.today/
2024-05-31 00:56:44,Michael Saylor Delivers Key Bitcoin Tip,https://u.today/
2024-05-31 00:56:44,Shiba Inu Celebrates 3 Years Since Vitalik Buterin's Epic 410 Trillion SHIB Burn,https://u.today/
2024-05-31 00:56:44,Here's When Bitcoin (BTC) Will Explode,https://u.today/
2024-05-31 00:56:44,"Ethereum (ETH) to Break $4,100 as Falling Wedge Pattern Plays Out",https://u.today/
2024-05-31 00:56:44,Ripple v. SEC: New Filing Details Controversial XRP Sales,https://u.today/
2024-05-31 00:56:44,SHIB Burns Skyrocket as Shibarium Releases New Critical BONE Update,https://u.today/
2024-05-31 00:56:44,Justin Bons Slams Solana Critics Amid Optimized Transaction Record,https://u.today/
2024-05-31 00:56:44,"Crucial Negative Ethereum ETF Statement Made by Samson Mow, Here's His Message",https://u.today/
2024-05-31 00:56:44,Shiba Inu (SHIB) Brutally Denied at $0.00003: What's Next?,https://u.today/
2024-05-31 00:56:44,Vitalik Buterin Issues Major Warning on 'Official' Crypto Scams,https://u.today/
2024-05-31 00:56:44,Vitalik Buterin Supports Tornado Cash Devs with 30 ETH Donation,https://beincrypto.com/
2024-05-31 00:56:44,How AI Boosts Crypto Influencers’ Content,https://beincrypto.com/
2024-05-31 00:56:44,Iggy Azalea’s Meme Coin Launch Marred by $2 Million Insider Trading Allegations,https://beincrypto.com/
2024-05-31 00:56:44,Dogwifhat (WIF) Is Still Capable of a Rally Despite the 10% Decline,https://beincrypto.com/
2024-05-31 00:56:44,Analyst Reveals Top Influencers Altcoin Traders Should Follow,https://beincrypto.com/
2024-05-31 00:56:44,Elon Musk to Shape Crypto Strategy for Donald Trump’s Election Campaign: Reports,https://beincrypto.com/
2024-05-31 00:56:44,Joe Biden Urged to Reconsider Veto Threat on SAB 121 Repeal,https://www.cryptotimes.io/category/market-news/
2024-05-31 00:56:44,Senate Unlikely to Pass FIT21 Before November Election,https://www.cryptotimes.io/category/market-news/
2024-05-31 00:56:44,Robinhood Launches Crypto Trading API for US Users,https://www.cryptotimes.io/category/market-news/
2024-05-31 00:56:44,Ripple CTO Trolls With ‘Proof’ He’s Not Satoshi Nakamoto,https://www.cryptotimes.io/category/market-news/
2024-05-31 00:56:44,Hidden Road Halts ByBit Access Over KYC and AML Concerns,https://www.cryptotimes.io/category/market-news/
2024-05-31 00:56:44,Shiba Inu’s Lucie S. Warns Against Celebrity-Endorsed Crypto,https://www.cryptotimes.io/category/market-news/
2024-05-31 00:56:44,"Terraform Labs, Do Kwon to Reach A Settlement with US SEC",https://www.cryptotimes.io/category/market-news/
2024-05-31 00:56:44,New York Tightens Customer Service Rules for Virtual Currency Firms,https://www.cryptotimes.io/category/market-news/
2024-05-31 00:56:44,Stablecoins: A Comprehensive Guide to Different Types and Use Cases,https://www.cryptotimes.io/category/market-news/
2024-05-31 00:56:44,Musk and Trump Discuss Crypto Policy Amid Campaign Trails,https://www.cryptotimes.io/category/market-news/
2024-05-31 00:56:44,Babylon Secures $70M Investment Round with Paradigm Lead,https://www.cryptotimes.io/category/market-news/
2024-05-31 00:56:44,DOJ Arrests Botnet Mastermind for $130M Cyber Scam,https://www.cryptotimes.io/category/market-news/
2024-05-31 00:56:44,"Biden Gives Into Crypto Hype, Connects To Top Leaders: sources",https://www.cryptotimes.io/category/market-news/
2024-05-31 00:56:44,Robinhood Moves Close to Settle GameStop Meme Stocks Suit,https://www.cryptotimes.io/category/market-news/
2024-05-31 00:56:44,Ethereum Co-Founder Vitalik Buterin Donates to Legal Defense of Tornado Cash Developers,https://www.cryptotimes.io/category/market-news/
2024-05-31 00:56:44,U.S. Treasury Official Clarifies No Ban on Crypto Mixers,https://www.cryptotimes.io/category/market-news/
2024-05-31 00:56:44,Telegram’s New Crypto Wallet Provider is WOT Global,https://www.cryptotimes.io/category/market-news/
2024-05-31 00:56:44,Shibarium TVL Up 17% as BONE Transfer Time Drops to 45 Min,https://www.cryptotimes.io/category/market-news/
2024-05-31 00:56:44,CME Abandons Solana Futures Plans Amid Network Criticism,https://www.cryptotimes.io/category/market-news/
2024-05-31 00:56:44,Stablecoin Market Capitalization Reaches $161B in May 2024,https://www.cryptotimes.io/category/market-news/
2024-05-31 00:56:44,OKX Marketplace Supports zkEVM for Blockchain Gaming,https://www.cryptotimes.io/category/market-news/
2024-05-31 00:56:44,Disbarred Attorney Plead Guilty in $9.5M Crypto Ponzi Scheme,https://www.cryptotimes.io/category/market-news/
2024-05-31 00:56:44,Iggy Azalea’s MOTHER Coin Accused of Insider Dumping,https://www.cryptotimes.io/category/market-news/
2024-05-31 00:56:44,Former ConsenSys Employee Launches New Stablecoin USD3,https://www.cryptotimes.io/category/market-news/
2024-05-31 00:56:44,Bitfarms Rejects Takeover Proposal from Riot Platforms,https://www.cryptotimes.io/category/market-news/
2024-05-31 00:56:44,Gemini’s $2 Billion Crypto Return to Earn Members,https://www.cryptotimes.io/category/market-news/
2024-05-31 00:56:44,Israel’s Central Bank Initiates Digital Shekel Payment Challenge,https://www.cryptotimes.io/category/market-news/
2024-05-31 00:56:44,Mastercard Introduces Crypto Credential Pilot,https://www.cryptotimes.io/category/market-news/
2024-05-31 00:56:44,PayPal USD Stablecoin Goes Live on Solana Blockchain,https://www.cryptotimes.io/category/market-news/
2024-05-31 00:56:44,Helen Toner Unveils OpenAI Controversy on TED AI Show,https://www.cryptotimes.io/category/market-news/
2024-06-01 00:59:18,Franklin Templeton First to Disclose the Fee for Its Proposed Spot Ethereum ETF,https://decrypt.co/
2024-06-01 00:59:18,Kim Kardashian Courted Trouble Shilling Ethereum Max—Is Caitlyn Jenner's Meme Coin a Riskier Play?,https://decrypt.co/
2024-06-01 00:59:18,‘Hamster Kombat’ Telegram Crypto Game to Launch Token on The Open Network,https://decrypt.co/
2024-06-01 00:59:18,Joe Biden Joins Donald Trump In Courting Crypto Voters,https://decrypt.co/
2024-06-01 00:59:18,$300 Million In Bitcoin Stolen from Japanese Exchange,https://decrypt.co/
2024-06-01 00:59:18,Arbitrum Gaming Catalyst Set to Unlock $250 Million In Tokens,https://decrypt.co/
2024-06-01 00:59:18,"Do Kwon Settlement Lifts Terra Coins LUNA, LUNC",https://decrypt.co/
2024-06-01 00:59:18,Estonian Nationals On Trial for $575 Million Crypto Mining Fraud Case,https://decrypt.co/
